label,ltable_title,ltable_manufacturer,ltable_price,rtable_title,rtable_manufacturer,rtable_price,id
1,ulead systems dvd workshop 2,ulead systems,494.99,corel ulead dvd workshop 2 authoring software,,299.95,4981
1,recam remote monitoring software,mobi-technologies-inc .,129.0,mobi-cam 70008 monitoring and notification software,mobi-technologies-inc .,89.69,386
1,mobi recam camera monitoring and notification software,mobi,119.99,mobi-cam 70008 monitoring and notification software,mobi-technologies-inc .,89.69,132
1,logic pro 6 upgrade from logic platinum/gold 5 & 6,apple,199.99,apple software t9161ll/a logic platinum / gold 5 & 6 to logic pro 6 update,apple software,149.0,4598
1,encyclopedia britannica deluxe 2008 win/mac,avanquest,29.95,britannica deluxe 2008,,26.5,6633
1,3d bridge deluxe ( mac ),freeverse software,24.99,freeverse 3d bridge deluxe,,24.99,2963
1,tlc arthur 's kindergarten learning system 2008,encore,19.99,tlc arthur 's kindergarten learning system ( pc ) encore,,19.95,918
1,riverdeep arthur 's kindergarten,riverdeep,,tlc arthur 's kindergarten learning system ( pc ) encore,,19.95,4362
1,instant play electric guitar deluxe,topics entertainment,39.99,topics entertainment topics entertainment play electric guitar deluxe windows,,39.9,4447
1,jumpstart 4th-6th grade v 2.0 b43,knowledge adventure,19.99,knowledge adventure inc. jumpstart 4th-6th grade v 2.0 b43,,16.93,218
1,jumpstart advanced 3rd grade v2 .0,knowledge adventure,19.99,jumpstart advanced 3rd grade ( pc/mac ) knowledge adventure,,19.99,1354
1,jumpstart advanced 2nd grade v2 .0,knowledge adventure,19.99,jumpstart advanced 2nd grade ( pc/mac ) knowledge adventure,,19.99,4563
1,jumpstart advanced 1st grade v2 .0,knowledge adventure,19.99,jumpstart advanced 1st grade knowledge adventure,,19.99,2827
1,jumpstart advanced preschool v2 .0,knowledge adventure,19.99,knowledge adventure inc. jumpstart advanced preschool v2 .0,,16.93,3802
1,aquarium 3-in-one collection ( win/mac ),encore software,19.99,aquarium 3-in-one limited edition ( win 95 98 me 2000 xp/mac 10.1 or higher ),,19.95,2970
1,aquarium 3 in 1 collection limited edition for win/mac,encore software,19.99,encore software 10123 aquarium 3-in-one limited edition ( eurpac ) win 95 98 me 2000 xp,,18.97,5253
1,hoyle casino 2007,encore,19.95,encore software 10673 hoyle casino 2007 win 98 me 2000 xp,,18.97,6726
1,hoyle casino ( 2007 ),encore,19.99,encore software 10675 hoyle casino 2007 win 98 me 2000 xp,,18.97,1853
1,procurve vpn client software unlimited client licenses,hewlett packard,,procurve vpn client software unlimited client licenses,,2598.96,5310
1,adobe photoshop cs3 extended [ mac ],adobe,999.0,adobe photoshop cs3 extended for mac,,935.99,1628
1,systemsuite 8 professional,individual software,49.99,individual software inc systemsuite 8 professional ( us pos ),,46.42,5292
1,computrace lojack for laptops 3 year license ( mac ),absolute software,99.95,absolute software lfl-m2-36 computrace lojack for laptops 3 year license mac 10.2 or higher,,80.97,5821
1,computrace lojack for laptops 3 year license ( mac ),absolute software,99.95,computrace lojack for laptops 3 yr subscription,,89.99,3388
1,punch ! super home suite,punch ! software,49.99,punch software punch ! super home suite,,49.95,2801
1,instant home design ( jewel case ),topics entertainment,9.99,instant home design 1 ( jc ),,12.9,4057
1,punch ! professional home design suite,punch ! software,69.99,punch software 35100 punch ! professional home design suite ( small box ),punch software,62.99,4185
1,punch super home suite 3.0,punch ! software,49.99,punch software 17100 punch ! super home suite,punch software,45.99,117
1,family tree maker 2008 platinum,encore,99.95,encore inc family tree maker 2008 platinum,,85.07,2559
1,family tree maker version 16 essentials,encore,29.95,encore inc family tree maker v 16 essentials,,25.75,5247
1,family tree maker 11.2 collector 's edition,encore,109.95,family tree maker 11 collector 's edition,,34.9,4632
1,math advantage 2008,encore,39.99,encore inc math advantage 2008,,33.89,3381
1,elementary advantage 2008,encore,39.99,elementary advantage 2008 encore,,39.95,2737
1,turbocad mac 3d for mac,imsi,249.99,imsi design llc turbocad mac 3d,,204.67,2318
1,sound studio 3 : record edit add effects to audio ( mac ),freeverse software,79.99,sound studio 3 for mac,,79.99,3246
1,merriam-webster 's dictionary ( win/mac ) ( jewel case ),fogware publishing,9.99,merriam-webster 's dictionary ( win/mac ) ( jewel case ) ( 10462 ),,9.59,1038
1,usa/world extreme landscapes bundle,abacus,39.95,abacus usa/world extreme landscapes bundle,,38.43,2266
1,cinescore professional soundtrack edition,sony-pictures-digital-entertainment,249.95,sony media software cinescore soundtrack creation software audio software for video,sony-pictures-digital-entertainment,179.95,5824
1,emc retrospect 7.5 svr 1-client windows,dantz,249.0,emc insignia retrospect server client v. 7.5 complete package,,181.97,976
1,aircraft collector 's second edition,abacus,19.95,abacus aircraft collectors second edition,,17.55,4123
1,family tree maker version 16 deluxe,encore,69.95,family tree maker version 16 deluxe ( 10870 ),,57.59,3041
1,emedia bass method win/mac,emedia,59.99,emedia eg03014 bass method os x,emedia,53.99,2814
1,emedia intermediate guitar method os x,emedia,59.99,emedia eg04025 intermediate guitar method complete package,emedia,53.99,6271
1,steinberg cubase 4 digital audio software,steinberg,999.99,steinberg cubase 4 software music production software,,799.99,3247
1,steinberg cubase studio 4,steinberg,499.99,steinberg cubase studio 4 software music production software,,399.99,2110
1,brainfood games cranium collection 2006,encore software,19.99,encore software 11253 brain food games : cranium collection 2006 sb cs by encore,,17.97,2862
1,registry mechanic 5.x pc system repair,pc tools,29.95,encore software 10598 registry mechanic win 98 me 2000 xp,,26.97,1003
1,registry mechanic by encore software,encore software,46.52,encore software 10599 encore registry mechanic v. 5.1 complete product utility 1 user ( s ) complete product standard pc,,25.97,5780
1,registry mechanic 5.x pc system repair,pc tools,29.95,encore inc registry mechanic,,25.49,4690
1,the print shop 22 sb cs by the print shop,encore software,,encore software 10691 the print shop 22 sb cs by the print shop,,25.97,398
1,cubase 4 competitive crossgrade,steinberg ( yamaha ),549.99,steinberg cubase studio 4 software competitive crossgrade music production software,,199.99,418
1,autocad 2007 courseware customizing the interface,autodesk psg,47.95,autocad 2007 coursewarecustomizing the interface,,39.69,3536
1,humorous greeting card factory,nova development,29.99,nova development ghw humorous greeting card factory,nova development,29.99,2224
1,humorous greeting card factory,nova development,29.99,nova development corp humorous greeting card factory,,28.3,6605
1,microspot macdraft pe ( mac ),microspot ltd.,99.95,microspot macdraft pe personal edition,,85.99,6463
1,sierra hallmark card studio special edition windows ),nova development,,sierrahome hse hallmark card studio special edition win 98 me 2000 xp,sierrahome,19.26,6021
1,burning monkey solitaire 2005 edition,freeverse software,24.99,freeverse burning monkey solitaire 3d,,24.99,464
1,cubase se3 educational edition,steinberg,,steinberg software cubase se 3.0 educational edition,,145.73,4308
1,adobe photoshop cs2 ( mac ) [ old version ],adobe,649.0,adobe systems inc 13102124 adobe photoshop cs 2 mac os x v. 10.2.8 to 10.3,adobe systems inc,788.63,1909
1,pop-up stopper professional,panicware,29.99,csdc pop-up stopper professional panicware,,26.14,3910
1,punch ! super home suite,punch ! software,49.99,punch software 38100 punch ! super home suite ( small box ),punch software,45.99,1811
1,punch super home suite 3.0,punch ! software,49.99,punch software 17100 punch ! super home suite,punch software,45.99,3757
1,punch ! super home suite,punch ! software,49.99,punch software 38100 punch ! super home suite ( small box ),punch software,45.99,2961
1,aquazone bass edition,smith-micro-software,19.99,allume aquazone bass edition,smith-micro-software,19.99,5370
1,allume aquazone seven seas deluxe,allume,38.89,allume aquazone seven seas deluxe edition,,24.99,4457
1,stuffit deluxe 11,aladdin systems,49.99,allume systems inc stuffit deluxe 11,,42.74,5895
1,marine aquarium & goldfish screen saver by encore software,encore software,,marine aquarium & goldfishscreen saver by encore software,,18.27,5844
1,hp sp linux we 50 lic/cd 3.0 c t3586a ),hewlett-packard - ( consumables ),,sp linux we 50 lic/cd 3.0 c,hewlett-packard - ( consumables ),69216.95,3926
1,hp sp linux we 50 lic/cd 3.0 c t3586a ),hewlett-packard - ( consumables ),,sp linux we 50 lic/cd 3.0 c,,69216.95,3367
1,textbridge pro 11,nuance-communications-inc .,79.99,scansoft textbridge pro v. 11,nuance-communications-inc .,68.99,3845
1,efrontier anime studio pro ( win/mac ),efrontier,199.99,allume anime studio pro,,179.99,6697
1,cakewalk sonar home studio 6 xl,cakewalk,209.0,cakewalk sonar home studio 6 xl software music production software,,159.0,5126
1,microsoft data analyzer 2002,microsoft,179.0,microsoft ho2-00003 data analyzer 2002 complete package 1 user,microsoft,154.99,880
1,home design architect series 3000 v10 .0,punch ! software,149.95,punch software 83100 punch ! home design architectural series 3000 v 10 ( win 98 me nt 2000 xp ),,124.97,3822
1,logic express 7,apple computer,299.0,apple/emagic logic express 7.2 software music production software,,299.0,4289
1,pc cakewalk guitar tracks pro 3,cakewalk,149.99,cakewalk guitar tracks pro 3 music production software,,99.0,837
1,sony acid pro 6 professional music workstation,sony-pictures-digital-entertainment,499.95,sony media software acid pro 6 software music production software,sony-pictures-digital-entertainment,299.95,6837
1,sibelius compass,sibelius-software-ltd .,159.99,sibelius compass music composition teaching software music production software,sibelius-software-ltd .,119.95,4452
1,elementary advantage 2008,encore software,,encore inc elementary advantage 2008,,33.89,2925
1,quickverse mac bible study 2007 gold box,findex,349.95,findex.com inc quickverse mac bible study 2007 gold box,,215.42,5137
1,adobe soundbooth cs3 [ mac ],adobe,199.0,adobe soundbooth cs3,,205.99,1494
1,norton internet security 2008 10 user,symantec,199.99,norton internet security 2008 10 user,,199.99,4253
1,adobe photoshop elements 4.0 ( mac ),adobe,89.99,adobe photoshop elements 4.0 mac,,79.99,2938
1,photoshop elements 4 mac retail eng 1u ( 19230169 ),adobe,145.39,adobe photoshop elements 4.0 mac,,79.99,384
1,business card factory deluxe 3.0,nova development,29.99,nova development corp business card factory deluxe 3.0,,28.3,2049
1,middle school success essentials,topics entertainment,29.99,topics entertainment middle school success essentials,,17.55,1527
1,studyworks ! teaching pro : middle school math & science ( win/mac ),global-software-publishing,29.99,middle school math & science,global-software-publishing,12.9,679
1,palo alto business plan pro 2007,palo-alto-software,99.95,palo alto software bppx palo alto business plan 2007 pro complete product business planning 1 user complete product standard pc,,83.97,1772
1,palo alto business plan pro premier 2007,palo-alto-software,199.0,palo alto software bpdx palo alto business plan 2007 pro premier edition complete product business planning 1 user complete product standard pc,palo-alto-software,184.97,4517
1,onone genuine fractals 5 full 1u,onone software,159.95,onone software inc. gfs-50211 genuine fractals 5 full 1u,,148.97,288
1,quickbooks pro 2007 for mac ( mac ),intuit,199.95,intuit quickbooks pro 2007 software for mac finance software,,189.95,927
1,adobe fireworks cs3 [ mac ],adobe,299.0,adobe fireworks cs3,,309.99,3040
1,namo webeditor 2006,namo,99.99,csdc namo webeditor suite 2006,,83.92,2777
1,casual games pack,egames,19.99,egames . inc casual games pack,,16.62,4238
1,galaxy of games 5000,2k games,19.99,egames . inc galaxy of games 5000 pack,,16.62,5509
1,genuine fractals print pro 5 1u,onone software,299.95,onone software inc. gpp-55211 genuine fractals print pro 5 1u,,274.97,5877
1,genuine fractals print pro 4.1 sharpener pro 2.0,onone software,,onone software inc. gfn-42001 genuine fractals print pro v. 4.1 with nik sharpener pro 2.0 license standard license pc mac,,320.97,4526
1,math success deluxe 2008,topics entertainment,49.99,topics entertainment math success deluxe 2008,,31.06,601
1,phonics success deluxe 2006 ( large box ),topics entertainment,49.99,phonics success deluxe 2006,,22.9,1105
1,sony acid music studio,sony-pictures-digital-entertainment,69.99,acid music studio 6,sony-pictures-digital-entertainment,59.95,5151
1,apple iwork '06 family pack ( mac dvd ) [ older version ],apple,99.0,apple iwork '06 family pack,,99.99,1886
1,apple ilife '06 ( mac dvd ) [ older version ],apple computer,79.0,ilife '06 mac apple ma166z/a,,47.8,1534
1,apple mac os x tiger 10.4.6 family pack ( mac ),apple computer,199.0,apple mac os x v10 .4 tiger software family pack apple & mac software,,199.95,3565
1,apple mac os x tiger 10.4.6 family pack ( mac ),apple computer,199.0,apple mac os x 10.4.6 tiger family pack,,185.99,1822
1,apple ilife '06 family pack ( mac dvd ) [ older version ],apple computer,99.0,apple ilife '06 family pack,,99.99,5367
1,apple ilife '06 family pack ( mac dvd ) [ older version ],apple computer,99.0,apple ilife '06 family pack software av production software,,99.0,1301
1,printmaster 17 gold by encore software,encore software,30.66,encore software 10478 encore printmaster v. 17.0 gold complete product creativity application 1 user ( s ) complete product standard pc,,17.97,3697
1,the print shop design suite pro ed sb cs by the print shop,encore software,199.99,encore software 10931 the print shop design suite proed sb cs by the print shop,,105.97,107
1,printmaster 17 platinum by encore software,encore software,39.99,encore software 10485 encore printmaster v. 17.0 platinum complete product creativity application 1 user complete product standard pc,,33.97,3361
1,starry night galaxy explorer ( pc & mac ),imaginova,9.99,starry night galaxy explorer ( pc & mac ) ( snge-5-c1u ),,9.59,128
1,rise of nations : gold ( mac ),macsoft,49.99,destineer rise of nations gold edition,,45.99,1468
1,ca arcserve bkup protection suite exch r11 .5 upgrade prod only,computer associates,,arcserve bkup protection suite exch r11 .5 upg-v prod only,,2249.99,2200
1,my guitar,emedia,29.95,emedia music corp my guitar,,24.81,6250
1,age of empires iii : the warchiefs expansion pack ( mac ),destineer,34.95,destineer inc age of empires iii : the warchiefs expansion pack,,26.14,5384
1,age of empires iii : the warchiefs expansion pack ( mac ),destineer,34.95,age of empires iii : warchiefs expansion pack,,34.95,3574
1,corefx three level,core learning,59.95,sos aggregation company corefx three level-core learning ltd.,,51.09,5127
1,street atlas usa 2007 plus dvd,delorme,59.95,delorme mapping street atlas usa 2007 plus dvd xx,,53.37,5542
1,delorme topo usa mapping software 6.0 east region,delorme,49.95,delorme mapping topo usa 6.0 east region,,43.36,4100
1,delorme topo usa mapping software 6.0 west region,delorme,49.95,delorme mapping topo usa 6.0 west region,,43.36,33
1,pc tools spyware doctor 2007 sb cs by pc tools,encore software,29.99,encore software 10991 pc tools spyware doctor 2007 sbcs by pc tools,,25.97,4694
1,pc tools spyware doctor 2007,encore,29.95,encore software 10990 pc tools spyware doctor 2007 win 98 me 2000 xp,,26.97,2998
1,cakewalk project5 version 2,cakewalk,259.0,cakewalk project5 version 2 software music production software,,199.0,2061
1,project x project management software,marware,199.95,marware project x project management software,,179.99,5994
1,the print shop 21 deluxe by broderbund,encore software,,encore software 10038 encore the print shop v. 21.0 deluxe print management pc,,41.97,1322
1,apple iwork '06 ( mac dvd ),apple,79.0,iwork '06 ( mac ) apple,,79.99,591
1,apple . mac 4.0 online service family pack,apple,179.95,apple . mac 4.0 family pack ( new or renewal ),,145.99,1726
1,chessmaster 9000 ( mac ),feral interactive,39.99,chessmaster 9000 : feral interactive,,38.99,5591
1,chessmaster 9000 ( mac ),feral interactive,39.99,feral interactive limited chessmaster 9000,,35.98,2457
1,land before time : kindergarten,brighter-minds-media-inc .,9.99,brighter minds land before time : kindergarten,brighter-minds-media-inc .,9.99,1048
1,land before time : kindergarten,brighter-minds-media-inc .,9.99,the land before time : kindergarten adventure,,12.9,244
1,land before time : preschool,brighter-minds-media-inc .,9.99,the land before time : preschool adventure,brighter-minds-media-inc .,12.9,5162
1,onone essentials for adobe photoshop elements version 2 full,onone software,59.95,onone software essentials for adobe photoshop elements version 2 full,,59.33,5021
1,mariner calc speadsheet ( mac ),mariner software,59.99,mariner calc spreadsheet software,,52.99,6389
1,marine aquarium + sharks,encore software,9.95,encore software 10272 marine aquarium + sharks win 98 me 2000 xp,,7.69,210
1,clickart fonts ( 2006 ) by encore,encore software,19.99,encore software 10463 clickart fonts ( 2006 ) by encore,,17.97,1170
1,jumpstart world 1st grade,knowledge adventure,19.99,knowledge adventure inc. 20223 jumpstart world 1st grade mini box,,16.93,984
1,jumpstart 1st grade,knowledge adventure,,jumpstart 1st grade ( jc ),,9.9,6861
1,adobe premiere elements 3.0 [ lb ],adobe,99.99,adobe premiere elements 3 video editing software for windows consumer video editing software,,99.95,6665
1,mavis beacon teaches typing deluxe v17,encore software,39.99,broderbund mavis beacon teaches typing deluxe17,,36.99,5700
1,phase one capture one le,phase one,,phase one capture one le,,76.99,4626
1,phase one capture one pro win/mac,phase one,499.0,phase one capture one pro,,415.99,5
1,final cut express 2.0 upgrade,apple computer,99.99,apple software m9372z/a final cut express 2.0 upgrade,apple software,79.99,4784
1,apple final cut express hd 3.5 ( mac ),apple computer,299.0,apple final cut express hd 3.5 video editing software for mac av production software,,299.0,4182
1,logic express 7,apple computer,299.0,apple logic express 7.2,,299.99,3001
1,century software tinyterm plus v. 4.0 complete product,century software,,century software ttpl-1 century tinyterm plus v. 4.0 complete product connectivity/data acess 1 user ( s ) complete product standard english pc,,188.97,3457
1,hp dss software v. 4.0 complete package t1936aa ua0 ),hewlett-packard - ( consumables ),630.36,hp t1936aa uao digital sending software 4.0 ( 10 device license ),hp,369.99,2032
1,findex quickverse bible study 2007 bible-suite,findex,,findex.com inc quickverse bible study 2007 bible suite,,24.89,5205
1,readiris pro 11 corporate edition ( mac ),iris,499.95,iris inc readiris pro 11 corporate edition,,430.58,4012
1,readiris pro 11 corporate edition,iris inc.,399.99,readiris pro 11 corporate edition for pc,,349.99,1544
1,guitar tool worship edition,midisoft corporation,,midisoft corporation guitar tool worship edition,,43.36,5207
1,micromat podlock ( mac ),micromat,69.0,micromat podlock ipod utility software,,39.99,269
1,micromat protogo,micromat,,micromat techtool protogo,,109.99,2373
1,micromat techtool pro 4 ( mac ),micromat,99.99,micromat tech tool pro 4.5,,82.99,3131
1,emedia guitarpro 5 win/mac,emedia,59.99,emedia music corp guitar pro v 5.1 ( hybrid ),,51.92,4948
1,emedia rock guitar method,emedia,39.99,emedia rock guitar method ( win 95 98 me nt 2000 xp/mac 8.0 ),,39.15,4595
1,lego star wars ( dvd ) ( mac ),aspyr media,29.99,aspyr lego star wars,,29.99,4872
1,star wars empire at war ( intel only macs ),aspyr media,49.99,star wars empire at war ( mac intel ),,49.99,5625
1,lego star wars ii : the original trilogy for mac,feral interactive,39.99,aspyr lego star wars ii,,44.95,2215
1,quicken 2007 home & business,intuit,89.95,quicken home and business 2007 ( pc ) intuit,,89.99,6406
1,quicken 2007 deluxe,intuit,59.95,quicken 2007 deluxe win cd,intuit,57.99,5685
1,quicken 2007 for mac,intuit,69.95,intuit quicken mac 2007 software finance software,,69.95,4551
1,appleworks 6.2.9,apple,79.0,appleworks 6.2 for mac,,75.99,425
1,sims 2 nightlife expansion pack,aspyr media,34.99,aspyr media inc sims 2 nightlife,,33.21,3745
1,kaplan sat/act/psat platinum 2007 win/mac,topics entertainment,49.99,sat act & psat 2007 platinum,,29.85,85
1,adventure workshop 1st-3rd grade 8th edition,encore,19.99,adventure workshop 1st-3rd grade . 8th edition ( pc ) encore,,19.95,817
1,adventure workshop 4th-6th grade 7th ed sb cs by riverdeep,encore software,19.99,encore software 10118 adventure workshop 4th-6th grade 7th ed sb cs by riverdeep,,17.97,6174
1,world of warcraft expansion : burning crusade,blizzard entertainment,39.99,world of warcraft burning crusade,,39.99,2761
1,world of warcraft 60 day pre-paid time card,blizzard entertainment,29.99,vivendi-universal games inc 72305 world of warcraft 60 day prepaid,,27.99,3407
1,academy award winners,yamaha,31.95,bobby walters academy award winners,,23.59,6679
1,adventure workshop preschool ( jewel case ),encore software,29.99,encore software 10538 adventure workshop preschool 7 by the learning company,,17.97,1547
1,apple logic pro 7.2 upgrade,apple,299.0,apple/emagic logic pro 7.2 software upgrade music production software,,259.95,3122
1,quickbooks simple start 2007,intuit,99.95,quickbooks simple start 2007 intuit,,99.99,2398
1,microsoft licenses word mac 10.0 eng govt ( d4800369 ),microsoft licenses,349.83,microsoft d48-00369 word mac 10.0 eng gov ' t 659556873790,,191.94,106
1,print shop 22 deluxe,encore,49.99,encore inc print shop 22 deluxe,,42.69,5499
1,swift publisher for mac,global-marketing-partners,39.99,belight swift publisher page layout software,global-marketing-partners,39.99,5190
1,monopoly here & now,encore,19.95,encore software 11180 monopoly here & now win 98 me 2000 xp,,18.97,5995
1,sony vegas 6 + dvd [ old version ],sony-pictures-digital-entertainment,899.95,vegas + dvd sony,sony-pictures-digital-entertainment,899.99,6424
1,vegas movie studiodvd +8 plat,sony media,129.95,sony vegas movie studio + dvd v8 platinum edition video editing software professional editing software,,129.95,6850
1,sony sound effects series vol 1 through 10,sony-pictures-digital-entertainment,,madison media software ssda3000 sony sound effects series vol 1 through 10,sony-pictures-digital-entertainment,370.97,3517
1,discrete drums : vol .1,sony-media-software,59.95,sony media software discrete drums : vol .1 sony sound series,sony-media-software,24.91,258
1,3d home architect home v. 8 by encore software,encore software,39.99,encore software 10634 3d home architect home v. 8 by,,33.97,5024
1,cakewalk sonar 6 producer ed,cakewalk,799.0,cakewalk sonar 6 producers edition software music production software,,459.95,3452
1,iaudioize magnetic time for pc and mac,sos aggregation,39.99,sos aggregation company iaudioize magnetic time,,31.53,5436
1,listen for ipod magnetic time,sos-aggregation-company,39.99,listen for ipod magnetic time ( win 2000 xp ),sos-aggregation-company,39.99,1182
1,iaudioize magnetic time for pc and mac,sos aggregation,39.99,iaudioize magnetic time for pc and mac,,39.99,5573
1,kaspersky anti-virus 6.0,kaspersky lab,59.95,kaspersky anti-virus 6.0 ( pc ),,59.99,1778
1,resumemaker professional 12.0,individual software,29.99,individual software resume maker professional deluxe 12.0,,29.99,6005
1,everquest : titanium,sony-creative-software,19.95,sony online entertainment inc 41032 everquest : titanium win 2000 xp,sony-creative-software,23.09,391
1,sportsman 's double play,masque publishing,19.95,masque publishing sportsmans double play,,17.55,717
1,sportsman 's double play,masque,,masque publishing sportsmans double play with american billiards,,17.55,5732
1,internet cleanup 3.0,aladdin systems,29.99,allume internet cleanup 3.0,,24.99,46
1,micromat techtool protege with firewire device,micromat,,micromat techtool protege utility with 1gb firewire flash drive,,219.99,642
1,3mds network operations manager diy annual subscptn 101 500u,3m,,3mds network operations managerdiy annual subscptn 101 500u,,144.63,5091
1,chicken hunter wanted jc,encore,9.99,encore software 10760 chicken hunter wanted win 98 me 2000 xp,,7.69,5948
1,poetry fiction and drama ( win/mac ) ( jewel case ),fogware publishing,9.99,poetry fiction and drama ( win/mac ) ( jewel case ) ( 10172 ),,9.59,6183
1,scholastic brain play : pre-kindergarten 1st grade,topics entertainment,19.99,brain play preschool 1st grade,,25.99,612
1,logic express 7.2 upgrade from logic express 6,apple-computer - ( direct ),99.0,apple logic express 7.2 upgrade from v. 6,apple-computer - ( direct ),99.99,4768
1,logic express 6,apple,299.99,apple software t9164ll/a logic express 6,apple software,219.0,5657
1,logic express 6,apple,299.99,apple software t9164ll/a logic express 6,apple software,219.0,1303
1,student home learning system for pc/mac,fogware publishing,139.99,student home learning system,,109.99,316
1,corel dvd moviefactory 6.0,corel,49.99,corel ulead dvd moviefactory 6 software for windows authoring software,,49.95,6009
1,corel dvd moviefactory 6.0 plus,corel,79.99,corel ulead dvd moviefactory plus 6 software for windows authoring software,,79.95,1965
1,corel dvd moviefactory 6.0 plus,corel,79.99,dvd moviefactory 6 plus,,77.32,3505
1,corel dvd moviefactory 6.0 plus,corel,79.99,corel corporation dvd movie factory 6 plus retial ( english ),,74.08,1166
1,the guild 2 pirates of the seas,dreamcatcher interactive,29.99,guild 2 : pirates of the seas,,23.99,1004
1,gmp data rescue license 24300 ),global-marketing-partners,349.0,prosoft engineering data rescue universal license,global-marketing-partners,236.34,5098
