label,ltable_title,ltable_manufacturer,ltable_price,rtable_title,rtable_manufacturer,rtable_price,id
1,scooby doo glowing bug man ( jewel case ),encore software,9.99,encore inc scooby doo glowing bug man,,7.79,7340
1,hoyle card games 2007,encore software,19.99,encore software 10565 hoyle card games 2007 win 98 me 2000 xp,,18.97,7346
1,comic book library,marvel,49.99,git comic book library collector 's edition vol . 1,,19.99,8338
1,iris readiris pro 11.0 ( mac ),i.r.i.s.,129.95,iris readiris pro 11 mac ocr,,109.99,7877
1,sudoku puzzle addict,global-software-publishing-north-america-inc,6.99,global software a2991m2w sudoku puzzle addict ( win 98 me 2000 xp ),global-software-publishing-north-america-inc,8.79,8057
1,more brain games,csdc,9.99,csdc more brain games on hand software,,7.17,8257
1,emedia blues guitar legends,emedia,29.94,emedia music corp emedia blues guitar legends,,24.81,8503
1,simple slide show,topics entertainment,19.99,simple slide show,,15.9,7058
1,eovia carrara 5 pro,eovia,,re : launch carrara 5 pro,,445.3,8972
1,age of empires iii,destineer,49.99,ages of empires iii,,45.99,8488
1,professor fujis sudoku deluxe by encore,encore software,19.99,encore software 10374 encore professor fuji 's sudoku deluxe complete product educational game 1 user ( s ) complete product standard pc,,17.97,7048
1,hoyle kids ' games jc,encore,9.99,encore software 10671 hoyle kids games win 98 me 2000 xp,,7.69,8738
1,imsi resume writer deluxe [ lb ],imsi design,19.95,resume writer deluxe,,12.9,8330
1,power on now up to date & contact windows,power-on-software,129.99,now software nuw45e1k now up-to-date & contact for windows,now software,114.99,9217
1,form workshop 1200,valusoft,29.99,form workshop 1200,,12.9,7069
1,the human body,topics entertainment,19.99,topics presents : human body,,15.9,9195
1,giggles computer funtime for baby shapes ( win/mac ),navarre ( software ),24.95,leveractive llc giggles computer funtime for baby shapes,,15.82,8598
1,clifford the big red dog thinking adventures,scholastic,9.99,clifford thinking,,12.9,7372
1,super collapse 3,mumbo jumbo,19.99,super collapse ! 3,,22.99,8561
1,internet cleanup 4.0 mac os 10.4 or higher,smith-micro-software,29.99,allume internet cleanup 4.0,smith-micro-software,29.99,9163
1,neuratron photoscore professional 4,sibelius-software-ltd .,199.99,sibelius photoscore professional scanning software music production software,sibelius-software-ltd .,179.95,8718
1,pc vegas dvd,sony-pictures-home-entertainment,899.99,vegas + dvd sony,sony-pictures-digital-entertainment,899.99,7987
1,symantec pcanywhere 12.0 host only,symantec,169.65,symantec symantec pcanywhere 12 0 host remote,,99.9,8230
1,webroot spysweeper antispyware 3 user,webroot software,39.99,webroot software 65210 spy sweeper 3 pc,webroot software,31.99,9199
1,marine aquarium 2.0 ( mac ),encore,19.99,encore marine aquarium 2.0,,19.99,7403
1,snap ! 10 000 drink recipies ( jewel case ),topics entertainment,4.99,10000 drink recipe snap,,8.95,7521
1,punch super home suite 3.0,punch ! software,49.99,punch software 17100 punch ! super home suite,punch software,45.99,8325
1,weekly reader mastering elementary/middle school math learning,fogware publishing,19.99,weekly reader mastering elementary & middle school math ( pc/mac ) fogware,,19.99,9260
1,eovia carrara 4 pro win/mac,eovia corporation,599.99,eovia carrara 4 pro software mac/win animation software,,569.0,8196
1,learn to play chess with fritz & chesster 2 ( mac ),viva media,29.99,viva media llc learn to play chess with fritz & chesster 2,,26.14,8113
1,logic pro 6,apple,999.99,apple software t9163ll/a logic pro 6,apple software,809.0,7354
1,your desktop post office for pc,stamps.com,14.99,stamps.com your desktop post office,,13.38,7842
1,h & r block taxcut 2006 premium federal,h & r block,19.99,h & r block taxcut premium federal software for mac and windows tax & finance software,,18.95,9029
1,poser figure artist,efrontier,99.99,allume systems inc poser figure artist,,92.51,8807
1,handmark oxford american desk dictionary and thesaurus,handmark inc. .,,palmspring software 523 oxford american desk dictionary,palmspring software,24.2,8817
1,cisco security server agent for windows and solaris license 100 agents win solaris csa-b100-srvr-k9 ),cisco-systems-enterprise,,cisco security server agent ( windows and solaris ) 100-agent bundle,cisco-systems-enterprise,64821.43,8108
1,time money & fractions grades 1-2,school zone,9.99,school zone interactive time money & fractions 1-2 on track software,,9.45,9130
1,f-secure internet security 2007 3 pcs,global-marketing-partners,79.99,f-secure internet security 2007 3 pcs ( global marketing partners ),global-marketing-partners,63.35,7635
1,quickverse bible premier suite,individual software,39.99,individual software inc quickverse bible premier suite ( us pos ),,37.19,6986
1,peachtree by sage premium accounting 2007,sage software,499.99,sage software peachtree premium accounting 2007 software for windows tax & finance software,,469.95,6985
1,middle school advantage 2008,encore,39.99,encore software 12370 middle school advantage 2008 win 2000 xp vista,,34.97,8332
1,quickbooks customer manager 2.5,intuit,79.95,intuit quickbooks customer manager 2.5 for windows tax & finance software,,79.95,8784
1,safekeeper plus,bling software,,bling software limited safekeeper plus,,39.99,7409
1,winway resume deluxe 11.0 network 10,nova development,,nova development rgw-n10 winway resume deluxe 11.0,nova development,349.99,8238
1,freddi fish 2 : the haunted schoolhouse,humongous entertainment,29.95,freddi fish 2 case of haunted schl hse,,7.5,8852
1,monopoly tycoon,encore,9.99,encore software 11630 monopoly tycoon win 98 me 2000 xp,,7.69,7582
1,cyberchase adventures : carnival chaos and casablanca quest,brighter-minds-media-inc .,19.99,cyberchase adventures by brighter minds,brighter-minds-media-inc .,19.99,8619
1,wild photo effects ( jewel case ),on-hand-software,9.99,csdc wild photo effects on hand software,on-hand-software,7.17,7994
1,sibelius 4 educational edition,sibelius-software-ltd .,329.0,sibelius sibelius 4 software educational discount music production software,sibelius-software-ltd .,249.95,9061
1,web graphics creator,sos-aggregation-company,39.95,sos aggregation company web graphics creator laughingbird software,sos-aggregation-company,31.26,7577
1,gorilla 4 standard,jungle software,299.0,jungle software gorilla standard 4.0 film production,,269.99,7461
1,model web publisher 3.5.2 .,computer-associates-international,,computer associates mdlweb99000352 model web publisher 3.52,computer-associates-international,835.99,7292
1,oxford world encyclopedia,tri synergy,19.99,tri synergy inc oxford world encyclopedia,,16.31,7067
1,business plan writer deluxe 8.0 2005,nova development,99.99,nova development bsw business plan writer deluxe 8.0,nova development,94.99,8139
1,ipswitch inc ws ftp pro 9 sdk w / ws ftp pro wd-1000-0900 ),ipswitch inc,395.0,ipswitch wd-1000-0900 ws_ftp pro 9 sdk w / ws_ftp pro,ipswitch,325.51,6982
1,call of duty deluxe ( mac ) ( dvd ),aspyr media,39.99,aspyr call of duty deluxe,,53.99,8662
1,math success deluxe 2007,topics entertainment,39.99,topics entertainment 80796 topics math success 2007 deluxe for windows educational software pc,,33.97,8716
1,singleclick network now ! pro,encore software,39.99,network now ! pro ( pc ) encore,,39.99,7447
1,apple remote desktop 2.2 10 client ( old version ),apple,299.0,apple software m9953z/a remote desktop 2.2 10 client,apple software,294.99,7086
1,travelogue 360 : paris,aspyr media,29.99,aspyr media inc travelogue 360 : paris,,27.99,8670
1,pro photo essentials plug in suite & iview mediapro 3,onone software,499.95,onone software inc. ppi-12005 pro photo essentials plug in suite & iview mediapro 3,,450.97,8869
1,guild wars nightfall,ncsoft,49.99,nc interactive inc guild wars nightfall,,48.27,9184
1,chicken hunter : license to grill the great poultry race,encore,9.99,encore software 10149 chicken hunter license to grill ( win 98 me 2000 xp ),,7.69,8107
1,extensis smartscale 1-user pxe-11433 ),extensis corporation,,onone software pxe-11433 pxl smartscale elect 1-user english mac/win,onone software,158.99,9148
1,x-oom internet movies 2,x-oom,,x-oom internet movies 2,,22.9,7724
1,vault360 combo,navarre ( software ),29.95,bamboo technology llc vault360 combo,,24.58,8348
1,digital video and audio production book for vegas 7 + dvd,sony-pictures-digital-entertainment,49.35,digital video & audio prod book,sony-pictures-digital-entertainment,27.5,8737
1,reader rabbit preschool,the-learning-company,29.99,reader rabbit preschool,the-learning-company,17.9,9087
1,best of slots 2 ( jewel case ),masque publishing,9.99,masque publishing best of slots ii,,8.46,8177
1,gsp greatest moments of our time,global-software-publishing-north-america-inc,9.99,global software publ na gsp greatest moments of our time,global-software-publishing-north-america-inc,8.14,7284
1,iremember digital scrapbooking 2.0,intriguing development,39.95,iremember 2.0 intriguing development,,32.99,8435
1,mcsa/mcse self-paced training kit ( exams 70-292 & 70-296 ) upgrading your certi,microsoft,70.0,mcsa/mcse self-paced training kit ( exams 70-292 and 70-296 ) upg . your,,39.95,9115
1,tune tools for ipod ( win/mac ),valusoft,19.99,valusoft tune tools for ipod,,21.99,7658
1,riding academy : jump & ride,viva media,19.99,viva media llc riding academy : jump & ride,,17.55,7299
1,didi & ditto : kindergarten win/mac,kutoka,19.99,kutoka interactive inc didi & ditto ( kindergarten ),,16.93,7258
1,firstedge v 2.0 ( mac ),myob us,99.95,myob firstedge,,99.99,7476
1,captain america the complete comic collection win/mac,git corp,49.95,git captain america : the complete collection dvd-rom,,42.99,6989
1,fisher-price rescue heroes : lava landslide,knowledge adventure,,fisher-price rescue heroes : hurricane havoc,,8.95,8992
1,intervideo windvd 8 gold,intervideo,49.99,corel intervideo windvd 8 gold software for windows authoring software,,49.95,7220
1,best of card games ( jewel case ),on-hand-software,9.99,csdc best of card games j/c on hand software,on-hand-software,7.17,9052
1,totally spies : zombie jamboree ( win/mac ),brighter-minds-media-inc .,9.95,totally spies zombie jamboree by brighter minds,brighter-minds-media-inc .,9.99,9193
1,x3 : reunion virtual programming ltd.,csdc,39.95,csdc x3mac x3 : reunion virtual programming ltd. mac 10.4 or later ub,csdc,42.6,7642
1,pc tutor learn windows vista & office 2007,nova development,29.99,nova development corp pc tutor learn windows vista & office 2007,,28.3,8455
1,return to castle wolfenstein ( mac ),aspyr media,29.99,aspyr return to castle wolfenstein,,30.99,8127
1,hallmark card studio 2006,sierra home,29.99,hallmark card studio 2006,,29.36,8642
1,gsp crossword addict,global-software-publishing-north-america-inc,9.99,global software a9716jcw crossword addict win 95 98 me 2000 xp,global-software-publishing-north-america-inc,8.79,8547
1,mavis beacon teaches typing deluxe 16,broderbund,39.99,mavis beacon teaches typing 16 deluxe,,34.9,8049
1,pantone reference library,pantone inc.,1623.06,pantone gps206 reference library,,907.97,8668
1,pc professor fuji 's kakuro,encore software,9.99,encore software 10653 professor fujis kakuro win 98 me 2000 xp,,7.69,8587
1,circus ponies-notebook 2.0 mac os,csdc,49.95,circus ponies notebook 2.0,,43.99,7256
1,tlc zoombinis 3rd grade lrng sys 2007 sb cs by riverdeep 10548 ),encore-software-inc,,encore software 10548 encore tlc zoombinis 3rd grade learning system 2007 complete product educational 1 user complete product standard pc mac,encore-software-inc,17.97,7464
1,hallmark blank greeting cards half-fold matte premium 20 count,nova development,12.99,hallmark blank greeting cards half-fold matte premium 20 count ( 2050xf ),,14.39,8233
1,miraizon cinematize 2 ( mac ),miraizon,69.99,miraizon cinematize 2,,65.99,7584
1,logic express 6,apple,299.99,apple software t9164ll/a logic express 6,apple software,219.0,7111
1,classification & ecology ( win/mac ) ( jewel case ),fogware publishing,9.99,middle school life science classification & ecology ( pc/mac ) fogware,,9.99,7540
1,watchguard serverlock manager ( 100 servers ),watchguard-technologies-inc,14995.0,serverlock manager 100 servers,watchguard-technologies-inc,56543.88,7736
1,live bingo,imagination-international-corp,,imagination international corp live bingo,imagination-international-corp,10.86,7983
1,cute ftp,tri synergy,39.99,cute ftp ( win 95 98 me nt 2000 xp ),,39.99,7649
1,microsoft licenses project svr sa govt ( h2200301 ),microsoft licenses,3601.4,microsoft h22-00301 gov open sa project svr w9x nt,,1995.12,7245
1,buzby breakin ' all the rules hermie and friends,digital praise,19.99,buzby ; breakin all the rules hermie and freinds - digital pr,,15.99,7489
1,cook 'n vegetarian,dvo enterprises,19.99,cookn vegetarian,,19.99,8163
1,the print shop pro publisher 22 deluxe [ dvd ],encore,99.99,the printshop pro publisher v22 deluxe dvd-rom,,69.9,7458
1,pitstop pro 7.0 upgr 6.x or higher,enfocus software,199.0,enfocus software pp7.0-ug-001 pitstop pro 7.0 upgr 6.x or higher,,171.97,8712
1,f/a -18 operation iraqi freedom,graphics-simulations-corporation,39.99,graphic simulations corporation f/a -18 operation iraqi freedom,graphics-simulations-corporation,37.82,6975
1,learn to play keyboard ( jewel case ),alfred publishing,9.99,alfred publishing inc learn to play keyboard,,7.22,8947
1,dk exotic animals africa,global-software-publishing,9.99,global software a4124m2h dk exotic animals africa win 95 98 2000 xp,global-software-publishing,9.08,6998
1,detto move2mac usb,detto-technologies-inc,71.31,detto move2mac usb kit ( to move data from pc to ma,detto-technologies-inc,44.99,7106
1,gorilla 4 student,jungle software,199.0,jungle software gorilla student 4.0 film production,,179.99,8616
1,flash action phonics made easy,school zone,14.99,school zone interactive flash action phonics made easy,,8.8,8138
1,stomp inc recover lost data 2005,stomp inc,39.95,recover lost data,,29.9,8900
1,freestyle street basketball,sierra online,19.99,vivendi-universal games inc freestyle street basketball,,18.48,8227
1,webexpress,ingram micro,69.99,microvision development webexpress,,57.52,7318
1,adobe dreamweaver cs3 [ mac ],adobe,399.0,adobe dreamweaver cs3,,415.99,10779
1,instant immersion translator deluxe 2.0,topics entertainment,49.99,instant immersion translator deluxe 2.0,,22.9,10276
1,instant immersion spanish 2.0,topics entertainment,29.99,instant immersion spanish 2.0 topics,,19.99,11282
1,i transfer dvds 2 ipod edition ( win/mac ),me-too-software,29.99,me too software i transfer dvds 2 ipod,me-too-software,29.99,10703
1,adobe flash pro cs3 upgrade [ mac ],adobe,199.0,adobe cs3 flash professional upgrade,,205.99,10375
1,instant immersion spanish deluxe 2.0,topics entertainment,49.99,instant immersion spanish deluxe 2.0 topics,,39.99,9756
1,instant immersion hawaiian audio,topics entertainment,,topics entertainment instant immersion hawaiian audio,,12.05,9894
1,instant immersion german v2 .0 ( pc & mac ),topics entertainment,29.99,topics entertainment instant immersion german 2.0,,17.55,9430
1,instant immersion japanese ( audio book ),topics entertainment,,instant immersion japanese ( audio book ) ( audio book ),,19.95,11403
1,microsoft outlook 2007,microsoft,109.95,microsoft office outlook 2007,,109.95,10070
1,microsoft onenote 2007,microsoft,99.95,microsoft onenote 2007 ( pc ),,99.95,9874
1,money home & business 2007 win32 eng na mini box us only cd,microsoft,139.43,microsoft money 2007 home and business ( pc ),,89.99,10480
1,microsoft office 2004 professional ( mac ),microsoft,499.99,microsoft microsoft office pro 2004 software suite mac apple & mac software,,498.95,10377
1,appleworks 6.2.9,apple,79.0,apple appleworks 6.2.9 ( mac ),,79.99,11588
1,learn2 training for microsoft powerpoint,topics-entertainment-software - ( consignment ),9.99,learn2 training for microsoft powerpoint ( win 95 98 me nt 2000 xp ),topics-entertainment-software - ( consignment ),9.99,10163
1,adobe creative suite cs3 design premium [ mac ],adobe,1799.0,adobe cs3 design premium,,1865.99,10057
1,adobe indesign cs3 upgrade [ mac ],adobe,199.0,adobe indesign cs3 for mac upgrade,,205.99,9900
1,sims 2 glamour life stuff pack,aspyr media,24.99,aspyr media inc sims 2 glamour life stuff pack,,23.44,10637
1,final draft av 2.5 win/mac,final draft,199.99,final-draft final draft av 2.5 screenwriting software mac/win screen writing software,,199.95,10343
1,punch 5 in 1 home design,punch ! software,39.99,punch software 20100 punch ! 5 in 1 home design,punch software,35.99,10997
1,adobe photoshop elements 4.0 ( mac ),adobe,89.99,adobe photoshop elements 4.0 photo-editing software for mac,,85.95,9885
1,mcafee internet security suite 2007 3 users,mcafee,89.99,mcafee internet security suite 2007 3-user ( pc ),,89.99,9515
1,instant immersion 33 languages,topics entertainment,49.99,instant immersion 33 languages,,47.36,10439
1,instant immersion spanish audio deluxe,topics entertainment,39.95,topics entertainment instant immersion spanish audio deluxe,,17.55,11642
1,microsoft office 2004 standard upgrade ( mac ),microsoft,239.99,microsoft office 2004 std upgrade,,219.99,9964
1,microsoft windows vista home basic upgrade [ dvd ],microsoft,99.95,microsoft windows vista home basic upgrade ( pc ),,99.99,9593
1,apple final cut studio 2 upgrade from final cut pro ( mac ),apple,699.0,apple final cut studio 2 upgrade from final cut pro,,699.99,10589
1,passwords plus 1.0,dataviz,29.99,passwords plus v. 1.0 complete package,,28.5,10753
1,hp dss software v. 4.0 complete package t1936aa ua0 ),hewlett-packard - ( consumables ),630.36,hewlett packard t1936aa ua0 hp digital sending software 4.0 complete product document management 1 device ( s ) complete product standard multilingual pc,hewlett-packard - ( consumables ),342.97,10677
1,punch ! professional home design,punch ! software,89.99,punch software 14100 punch ! professional home design suite for windows,punch software,62.99,9823
1,punch ! home design architectura series 18,punch ! software,129.99,punch software 41100 punch ! home design architectural series 18,punch software,118.99,11329
1,punch ! home design architectura series 18,punch ! software,129.99,punch software 41100 punch ! home design architectural series 18 complete product architectural 1 user ( s ) complete product standard english pc,,112.97,10736
1,quickbooks pro 2007 for mac ( mac ),intuit,199.95,intuit quickbooks pro 2007 for mac,,185.99,10901
1,adobe creative suite cs3 production premium upsell,adobe,1199.0,adobe cs3 production premium upsell,,1234.99,9580
1,adobe premiere pro cs3,adobe,799.0,adobe premiere pro cs3,,825.99,10851
1,musicalis guitar workshop,global-software-publishing,9.99,musicalis universal guitar workshop,global-software-publishing,12.9,9545
1,mac os x server v10 .4.7 10-client,apple,499.0,apple apple mac os x server 10 4 7 10 client,,499.0,11497
1,mac os x server v10 .4.7 unlimited client,apple,999.0,apple mac os x server tiger unlimited apple & mac software,,998.95,10999
1,microsoft digital image suite plus [ lb ],microsoft software,129.95,microsoft digital image suite plus full version of photo editing software for windows .,,89.95,9459
1,3d home architect landscape design deluxe version 9,encore,29.99,encore inc 3d home architect landscape design deluxe v 9.0,,25.49,10529
1,instant home design 3.0 [ lb ],topics entertainment,19.99,instant home design 3.0,,15.9,11372
1,instant architect design suite,imsi design,29.99,instant architect design suite ( 00ids510cc ),,28.79,10624
1,3d home architect landscape v. 8 by encore software,encore software,39.99,3d home architect landscape v. 8by encore software,,26.36,9496
1,ulead videostudio 11 plus,corel,129.99,video studio 11 plus,corel corporation,103.99,9571
1,adobe after effects cs3,adobe,999.0,adobe after effects cs3 professional software for windows effects software,,998.95,11569
1,microspot interiors,microspot ltd.,99.95,microspot interiors ( ints3 .6 sb ),,95.95,11119
1,adobe photoshop cs3 [ mac ],adobe,649.0,adobe photoshop cs3 for mac,,609.99,11237
1,adobe photoshop cs3 [ mac ],adobe,649.0,adobe photoshop cs3 ( mac os x v. 10.4.8 ),,649.0,9978
1,intuit quicken home inventory manager windows,intuit,34.95,intuit inc quicken home inventory manager,,29.78,11325
1,quicken 2007 home & business,intuit,89.95,intuit quicken home and business 2007 software for windows tax & finance software,,89.95,9723
1,reader rabbit learning system 1st grade,encore software,29.99,reader rabbit 1st grade,,17.9,11382
1,adobe creative suite cs3 production premium upgrade,adobe,799.0,production prem cs3 mac upgrad,adobe software,805.99,11645
1,adobe dreamweaver cs3 upgrade [ mac ],adobe,199.0,adobe dreamweaver cs3 upgrade,,205.99,11490
1,instant immersion french 2.0,topics entertainment,29.99,topics entertainment 80542 instant immersion french 2.0 781735805428,,18.2,10577
1,adobe creative suite cs3 web premium upsell [ mac ],adobe,1399.0,adobe cs3 web premium upsell,,1434.99,10844
1,iplaymusic beginner guitar lessons for the mac and ipod,iplaymusic,49.99,iplaymusic beginner guitar lessons mac,,44.95,10723
1,sims 2 nightlife expansion pack,aspyr media,34.99,aspyr sims 2 nightlife expansion pack,,35.99,9863
1,mindjet mindmanager 7 mac single license,mindjet,129.0,mindjet inc. mm7m mindjet mindmanager 7 mac single user w/wmedia,,112.97,10425
1,timbuktu remote control softwre 1 license for mac os,netopia,,netopia timbuktu pro for mac single license,,97.99,9722
1,microsoft windows vista business full version [ dvd ],microsoft,299.95,microsoft windows vista business retail no open box returns,,299.99,9440
1,apple remote desktop 2.2 10 client ( old version ),apple,299.0,apple software m9953z/a remote desktop 2.2 10 client,apple software,294.99,9508
1,reel deal slots mystic forest,phantom efx,19.95,phantom efx reel deal slots mystic forest,,17.24,9739
1,apple iwork '06 family pack ( mac dvd ) [ older version ],apple,99.0,apple iwork '06 family pack software apple & mac software,,99.0,10996
1,cosmi rom07524 print perfect business cards dvd,cosmi,,print perfect business cards dvd ( pc ) cosmi,,29.99,11287
1,corel wordperfect office x3 professional edition,corel,399.99,corel corporation corel wordperfect office x3 pro dvd,,369.09,9969
1,kids power fun for girls,topics entertainment,19.99,kids power fun for girls,,15.9,10519
1,adobe indesign cs3 upgrade from pagemaker [ mac ],adobe,199.0,adobe indesign cs3 for mac upgrade from pagemaker,,205.99,10678
1,webroot spysweeper antispyware 3 user,webroot software,39.99,webroot software 65210 spy sweeper 3 pc,webroot software,31.99,10049
1,webroot spysweeper antispyware 3 user,webroot software,39.99,webroot software 65210 spy sweeper 3 pc,webroot software,31.99,11529
1,marine aquarium & goldfish screen saver by encore software,encore software,,encore software 10561 marine aquarium & goldfish screen saver by,,17.97,11032
1,the sims 2 ( mac ),aspyr media,49.99,aspyr the sims 2,,45.99,10112
1,sims 2 pets expansion pack,aspyr media,34.99,sims 2 pets for mac,,34.99,9696
1,microsoft windows server 2003 client additional license for devices 5 pack,microsoft,209.0,microsoft windows server 2003 client additional license for devices 5 pack ( 823930 ),,158.39,11299
1,genuine fractals genuine fractals print pro 1u,onone software,299.95,onone software genuine fractals print pro software,,269.99,9963
1,apple final cut studio 2 upgrade from final cut studio ( mac ),apple,499.0,apple final cut studio 2 upgrade from final cut studio,,499.99,11652
1,sony sound forge audio studio 8,sony-pictures-digital-entertainment,69.99,sony media software sound forge audio studio 8 software music production software,sony-pictures-digital-entertainment,69.95,9767
1,punch ! master landscape & home design,punch ! software,99.99,punch software 25100 punch ! master landscape and home design,punch software,45.99,9991
1,make music allegro 2007 labpack 5 user,makemusic !,375.0,hal leonard allegro 2007 5-user labpack,,272.94,9944
1,national geographic presents : redshift planetarium,topics entertainment,29.99,national geographic redshift planetarium,,17.9,10926
1,school zone pencil-pal software big phonics ( cd-rom & book ),school-zone-interactive,,pencil-pal big phonics,school-zone-interactive,17.9,10223
1,nova greeting card factory ( mac ),nova development,49.99,nova greeting card factory for mac,,41.99,9400
1,apple iwork '06 ( mac dvd ),apple,79.0,apple iwork '06 software apple & mac software,,79.0,10547
1,system care professional,avanquest,49.95,avanquest usa llc system care professional,,43.32,10889
1,punch ! super home suite,punch ! software,49.99,punch software 38100 punch ! super home suite ( small box ),punch software,45.99,10803
1,final draft scriptwriter 's suite [ final draft 7 & final draft av2 ],final draft,349.99,final-draft scriptwriter 's suite 2.5 screenwriting software mac/win screen writing software,,279.95,11586
1,acid music studio 7,sony media,78.95,sony media software acid music studio 7 software music production software,,69.95,9411
1,intervideo windvd 8 platinum,corel,69.99,corel intervideo windvd 8 platinum software for windows authoring software,,69.95,10087
1,weekly reader preparing for kindergarten,fogware publishing,19.99,weekly reader preparing for kindergarten 2008 ( pc/mac ) fogware,,19.99,10821
1,m-audio pro tools m-powered 7.3 m-audio compatible world-class production software,m-audio,299.99,m-audio pro tools m-powered mpowered 7.3 software music production software,,249.0,11248
1,professor teaches windows xp,individual software,19.99,individual software professor teaches windows xp,,19.99,10089
1,punch ! master landscape professional & home design v 10.0,punch ! software,69.95,punch software 85100 master landscape professional & home design v 10.0,,61.8,9561
1,autodesk discreet combustion 4 windows ),autodesk,,autodesk combustion 4.0 compositing software win compositing software,,889.0,10729
