label,ltable_title,ltable_manufacturer,ltable_price,rtable_title,rtable_manufacturer,rtable_price,id
1,microsoft visio standard 2007 version upgrade,microsoft,129.95,microsoft office visio standard 2007 upgrade ( pc ),,129.95,3907
1,microsoft visual studio professional 2005 upgrade,microsoft software,549.0,visual studio pro 2005 upgrade ( pc ) microsoft,,549.0,1950
1,microsoft word 2004 ( mac ),microsoft,229.99,microsoft word 2004,,209.99,823
1,microsoft office 2004 standard ( mac ),microsoft,399.99,microsoft office 2004 standard,,369.99,836
1,microsoft word 2007 version upgrade,microsoft,109.95,microsoft word 2007 upgrade ( pc ),,109.95,2979
1,microsoft onenote 2007 upgrade,microsoft,79.95,microsoft onenote 2007 upgrade ( pc ),,79.95,3616
1,microsoft student with encarta premium 2008 dvd,microsoft,49.95,microsoft student with encarta premium 2008 complete package,,43.6,2890
1,microsoft office small business 2007 full version,microsoft,449.95,microsoft w87-02380 office sbe 2007 win32,,400.34,4862
1,microsoft office small business 2007,microsoft software,735.33,microsoft w87-02380 office sbe 2007 win32,,400.34,3063
1,microsoft mappoint 2006 with gps,microsoft,349.0,microsoft mappoint 2006 with gps locator ( pc ),,349.99,2363
1,microsoft office 2004 standard ( mac ),microsoft,399.99,microsoft microsoft office 2004 software suite mac apple & mac software,,399.95,2385
1,microsoft powerpoint 2004 ( mac ),microsoft,229.99,microsoft powerpoint 2004 software mac apple & mac software,,228.95,6348
1,ae mappoint 2006 cd,microsoft corp,49.95,microsoft b21-00806 ae mappoint 2006 cd,,50.39,3244
1,adobe flash pro cs3 [ mac ],adobe,699.0,adobe flash cs3 professional ( mac ),,699.0,2446
1,adobe flash pro cs3 [ mac ],adobe,699.0,adobe cs3 flash professional,,724.99,4899
1,microspot macdraft professional ( mac ),microspot ltd.,349.99,microspot macdraft professional edition,,249.99,5261
1,adobe after effects cs3,adobe,999.0,adobe after effects cs3 professional software for mac effects software,,998.95,1272
1,adobe acrobat standard 8.0,adobe,449.99,adobe acrobat v8 .0 professional for mac,,405.99,5792
1,omnioutliner professional 3.0,csdc,69.95,omnioutliner professional 3.0 for mac,,69.99,4091
1,i copy dvds 2 professional edition,me-too-software,69.99,i copydvds 2 professional edition,me-too-software,27.9,236
1,acrobat professional 8 mac upsell standard-professional,adobe,273.0,adobe acrobat v8 .0 professional for mac upsell from std-pro,,145.99,4364
1,adobe premiere pro cs3,adobe,799.0,adobe premiere pro cs3 video editing software for windows professional editing software,,798.95,610
1,diskeeper 2007 professional single lic pack,diskeeper corporation,79.21,diskeeper 2007 professional,,46.95,1480
1,motu digital performer 5 digital audio software competitive upgrade ( mac only ),motu,395.0,motu digital performer dp5 software music production software,,319.95,6345
1,illustrator cs3 13 mac ed 1u,adobe-education-box,199.0,adobe illustrator cs3 for mac academic,adobe-education-box,199.99,5405
1,adobe illustrator cs3 [ mac ],adobe,599.0,adobe illustrator cs3 ( mac ),,599.0,2891
1,adobe illustrator cs3 [ mac ],adobe,599.0,adobe illustrator cs3 for mac,,619.99,289
1,adobe illustrator cs3 upgrade [ mac ],adobe,199.0,adobe illustrator cs3 upgrade for mac,,206.99,4841
1,quickbooks simple start 2007,intuit,99.95,intuit quickbooks simple start edition 2007 software for windows tax & finance software,,83.95,337
1,quickbooks premier professional services edition 2007,intuit,399.95,intuit quickbooks premier professional services edition 2007 software win tax & finance software,,349.95,1832
1,quickbooks premier non-profit edition 2005,intuit inc.,499.95,intuit inc 284216 qckbks prem nonprofit ed 2005,,404.0,6669
1,mavis beacon teaches typing 17 standard,encore software,19.99,broderbund mavis beacon teaches typing standard17,,22.99,5295
1,mavis beacon teaches typing deluxe v17,encore software,39.99,mavis beacon teaches typing v17 deluxe pc/mac,,29.9,1875
1,mavis beacon teaches typing 16,broderbund,19.99,mavis beacon 16,,17.9,5475
1,mavis beacon 17 standard,encore software,19.95,mavis beacon teaches typing 17 standard ( pc/mac ) encore,,19.99,4207
1,mavis beacon typing 17 ( win/mac ),encore software,19.99,encore software 10076 mavis beacon typing 17 standardby broderbund,,17.97,1416
1,adobe creative suite cs3 design premium [ mac ],adobe,1799.0,adobe cs3 design premium upsell,,1639.99,2830
1,adobe premiere pro cs3,adobe,799.0,adobe premiere pro cs3 software with encore cs3 and onlocation cs3 ( windows only ) full version for windows,,723.95,4512
1,dreamweaver cs3 9 mac ed 1u,adobe-education-box,199.0,adobe dreamweaver cs3 academic,adobe-education-box,195.99,2161
1,adobe premiere pro cs3,adobe,799.0,adobe premiere pro cs3 software with encore cs3 and onlocation cs3 ( windows only ) full version for macintosh,,723.95,5975
1,adobe premiere pro cs3 upgrade,adobe,299.0,premiere pro cs3 mac upgrade,,320.25,1816
1,adobe creative suite cs3 design premium upgrade [ mac ],adobe,599.0,adobe cs3 design premium upgrade,,619.99,446
1,adobe creative suite cs3 production premium,adobe,1699.0,adobe cs3 production premium,,1749.99,693
1,adobe photoshop cs3 upgrade [ mac ],adobe,199.0,adobe photoshop cs3 for mac upgrade,,189.99,3378
1,tlc dr. seuss reading learning system 2008,encore,19.99,dr. seuss reading learning system 2008 encore,,19.95,3255
1,adobe after effects cs3 upgrade,adobe,299.0,adobe cs3 after effects upgrade,,306.99,5046
1,adobe premiere pro cs3 upgrade,adobe,299.0,adobe premiere pro cs3 upgrade,,308.99,6154
1,punch ! super home suite,punch ! software,49.99,punch software 38100 punch ! super home suite complete product architectural 1 user complete productcomplete productstandard english pc,,45.97,5860
1,punch ! home design architectural series 18,punch ! software,129.99,punch software 42100 punch ! home design architectural series 18 ( small box ),punch software,119.99,187
1,punch ! home design architectura series 18,punch ! software,129.99,punch software 41100 punch ! home design architectural series 18,punch software,118.99,5289
1,punch ! master landscape & home design,punch ! software,99.99,punch software 25100 punch ! master landscape & home design architectural 1 user ( s ) pc,,45.97,1449
1,punch ! 5 in 1 home design,punch ! software,39.99,punch software 24100 punch ! 5 in 1 home design complete product architectural 1 user complete productcomplete productstandard pc,,35.97,5347
1,3d home architect landscape designer v8,encore software,29.99,encore inc 3d home architect landscape designer v 8.0,,25.49,5048
1,punch ! professional home design suite,punch ! software,69.99,punch software 35100 punch ! professional home design suite ( small box ),punch software,62.99,5415
1,punch ! professional home design,punch ! software,89.99,punch software 14100 punch ! professional home design suite for windows,punch software,62.99,1221
1,punch ! professional home design platinum v10,punch ! software,99.0,punch software professional home design platinum version 10,,99.99,649
1,3d home architect home design deluxe version 9,encore,29.99,encore inc 3d home architect home design deluxe version 9,,25.49,4197
1,punch ! master landscape professional & home design v 10.0,punch ! software,69.95,punch software 85100 punch!master landscape pro v10 and home design,,59.97,5527
1,punch ! master landscape & home design,punch ! software,59.99,punch software 26100 punch ! master landscape & home design architectural 1 user ( s ) pc,,45.97,231
1,punch ! master landscape & home design,punch ! software,99.99,punch software 25100 punch ! master landscape and home design,punch software,45.99,3853
1,punch ! master landscape & home design,punch ! software,59.99,punch software 26100 punch ! master landscape and home design ( small box ),punch software,45.99,159
1,3d home architect landscape v. 8 by encore software,encore software,39.99,encore software 10636 3d home architect landscape v. 8by,,25.97,2099
1,3d home architect home v. 8 by encore software,encore software,39.99,3d home architect home v. 8by encore software,,33.92,5099
1,punch ! master landscape professional & home design v 10.0,punch ! software,69.95,punch software master landscape professional & home design v 10.0,,69.99,2521
1,punch ! home design architectura series 18,punch ! software,129.99,punch software 41100 punch ! home design architectural series 18,punch software,118.99,531
1,microsoft office student and teacher edition 2004 macintosh,microsoft,149.99,microsoft microsoft office 2004 software suite mac education apple & mac software,,148.95,5478
1,microsoft windows terminal server 2003 client additional license for users - 5 user,microsoft,669.0,microsoft windows terminal server 2003 client additional license for users - 5 user ( 824048 ),,719.04,1966
1,microsoft windows small business server cal 2003 license pack 20 client addpack device,microsoft software,,windows sbs cal 2003 20-clt addpak device cal microsoft t74-00003,,1413.42,3987
1,microsoft office mac 2004 english 3pk dsp 731-01163 ),microsoft corporation,,microsoft office 2004 software suite oem mac apple & mac software,,239.95,598
1,microsoft windows xp professional full version with sp2,microsoft,299.99,microsoft windows xp pro sp2 retail,,299.99,6607
1,microsoft windows xp home edition full version with sp2,microsoft,199.0,microsoft windows xp home edition sp2 retail box,,199.99,2107
1,microsoft office frontpage 2003 academic version windows ),microsoft,159.98,microsoft 392-02322 ae frontpage 2003,,87.99,5422
1,total training for adobe creative suite 3 : design premium bundle,total training,299.99,total training for adobe creative suite 3 design premium,,279.95,3275
1,adobe creative suite cs3 design standard upgrade,adobe,399.0,adobe cs3 design standard upgrade windows,,413.99,3011
1,adobe cs3 design standard macosx dvd,adobe,399.0,adobe cs3 design standard academic,,385.99,261
1,printmaster gold v 17.0,nova development,19.95,printmaster gold v 17.0 ( win 98 me 2000 xp ),,19.95,5008
1,printmaster gold v 17.0,encore software,19.99,encore inc printmaster gold v 17.0,,17.1,3884
1,adobe creative suite cs3 production premium,adobe,1699.0,adobe production premium cs3 software suite for windows professional editing software,,1698.95,2095
1,microsoft windows vista business full version [ dvd ],microsoft,299.95,microsoft windows vista business ( pc ),,299.99,6412
1,microsoft windows xp professional full version with sp2,microsoft,299.99,microsoft windows xp pro oem sp2 no open box returns,,149.99,5568
1,professor teaches windows xp,individual software,19.99,professor teaches windows xp individual software,,19.99,2284
1,adobe photoshop cs3 extended,adobe,999.0,adobe photoshop cs3 extended software full version for windows,,969.0,2769
1,microsoft windows vista business 32-bit for system builders,microsoft,179.99,microsoft windows vista business 32-bit oem,,149.99,26
1,avid liquid vs 7 software,avid technology,888.75,avid liquid 7.0 professional video editing software for windows professional editing software,,439.95,6272
1,microsoft office excel 2007,microsoft,229.95,microsoft excel 2007 ( pc ),,229.95,5636
1,microsoft office & windows training professional,topics entertainment,49.95,microsoft office and windows training professional,,29.99,548
1,microsoft office & windows training,topics entertainment,29.99,microsoft office and windows training ( win 98 me nt 2000 xp ),,29.95,1128
1,smart steps 4th grade,dorling-kindersley-multimedia - ( dk ),29.95,smart steps 4th grade ( jc ),dorling-kindersley-multimedia - ( dk ),11.95,3788
1,dk smart steps 3rd grade,global-software-publishing,9.99,global software a0454jch dk smart steps 3rd grade win 95 98 me 2000 xp vista,global-software-publishing,9.08,520
1,geometry ( win/mac ) ( jewel case ),fogware publishing,9.99,geometry ( win/mac ) ( jewel case ) ( 10158 ),,9.59,6606
1,cross stitch design studio ( jewel case ),m-and-r-technologies,9.99,cross stitch design studio ( jewel case ) ( 8006 ),m-and-r-technologies,9.59,2240
1,instant immersion italian v2 .0 ( large box ),topics entertainment,29.99,topics entertainment instant immersion italian 2.0,,17.55,5833
1,instant immersion german deluxe 2.0,topics entertainment,39.99,instant immers german dlux 2.0,,36.11,1941
1,instant immersion 33 languages,topics entertainment,49.99,instant immersion 33 languages,topics entertainment,43.99,2044
1,instant immersion italian platinum,topics entertainment,129.99,instant immersion italian platinum ( win 95 98 me nt 2000 xp ),,129.99,5105
1,instant immersion german audio,topics entertainment,,topics entertainment instant immersion german audio,,12.05,534
1,microsoft excel 2004 ( mac ),microsoft,229.99,microsoft excel 2004 spreadsheet software mac apple & mac software,,228.95,2606
1,onone software pxl smartscale windows and macintosh ),onone software,,pxl smartscale for mac/win,,159.95,3643
1,onone plug-in suite 3 for adobe photoshop,onone software,399.95,onone software plug-in suite full,,393.68,53
1,microsoft sql server developer edition 2005 cd/dvd,microsoft software,49.95,microsoft e32-00575 sql server 2005 developer edition x64 complete product dbms 1 developer ( s ) complete product standard english pc,,43.97,766
1,microspot interiors ( mac ),microspot ltd.,99.95,microspot interiors version 3.6,,85.99,586
1,microsoft licenses word olp c ( 05903871 ),microsoft licenses,205.73,microsoft 059-03871 molpc word sa,,111.78,5463
1,adobe photoshop cs3 extended upgrade [ mac ],adobe,349.0,adobe photoshop cs3 extended for mac upgrade,,329.99,4542
1,adobe illustrator cs3 upgrade from freehand [ mac ],adobe,199.0,adobe illustrator cs3 upgrade from freehand for mac,,206.99,1157
1,hoyle : classic collection 2006,encore,19.99,encore software 11052 hoyle : classic collection 2006 win 98 me 2000 xp,,18.97,1206
1,adobe creative suite cs3 production premium upgrade,adobe,799.0,adobe cs3 production premium upgrade,,822.99,6365
1,adobe indesign cs3 [ mac ],adobe,699.0,adobe indesign cs3 for mac,,725.99,5487
1,adobe creative suite cs3 master collection upsell,adobe,1999.0,adobe cs3 master collection upsell from cs1,,2054.99,2892
1,midway arcade treasures ( jewel case ),encore software,9.99,encore inc 28453 midway arcade treasures win 98 me 2000 xp,encore inc,19.38,119
1,apple garageband jam pack : symphony orchestra,apple,99.0,apple garageband jam pack : symphony orchestra,,95.99,190
1,apple garageband jam pack : world music,apple,99.0,apple garageband jam pack : world music,,95.99,2187
1,instant immersion french deluxe 2.0,topics entertainment,49.99,instant immers french dlx 2,,27.57,5281
1,instant immersion italian deluxe v2 .0 ( large box ),topics entertainment,29.99,topics entertainment instant immersion italian deluxe 2.0 ( mass merchant box ),,31.06,4527
1,instant immersion japanese deluxe 2.0,topics entertainment,39.99,instant immers japanese dlx 2 .,,36.11,794
1,instant immersion ingles audio deluxe,topics entertainment,,topics entertainment instant immersion ingles audio deluxe,,17.55,1029
1,instant play guitar deluxe v2 .,topics entertainment,39.48,topics entertainment instant play guitar deluxe v2 .0,,31.06,1713
1,punch ! professional home design platinum v10,punch ! software,99.0,punch software 86100 prof home design platinum v10 sb win 98 me nt 2000 xp,,84.97,1485
1,adobe creative suite cs3 design standard [ mac ],adobe,1199.0,adobe cs3 design standard,,1243.99,4394
1,adobe creative suite cs3 web standard [ mac ],adobe,999.0,adobe cs3 web standard,,1035.99,907
1,apple logic pro 7.2 retail,apple,999.0,apple/emagic logic pro 7.2 software music production software,,999.0,3558
1,makemusic finale 2007 win/mac,emedia,600.0,make finale 2007 software music production software,,429.95,2516
1,sibelius 5 professional edition,sibelius-software-ltd .,599.0,sibelius sibelius 5 software music production software,sibelius-software-ltd .,449.95,1863
1,digidesign music production toolkit ( pro tools le ),digidesign,495.0,digidesign music production toolkit music production software,,495.0,1096
1,steinberg sequel ( pc or mac ) music creation & performance software,steinberg,129.0,steinberg sequel music software music production software,,99.99,731
1,sibelius 4 professional edition,sibelius-software-ltd .,599.99,sibelius sibelius 4 software music production software,sibelius-software-ltd .,449.95,4202
1,adobe creative suite cs3 master collection [ mac ],adobe,2499.0,adobe cs3 master collection,,2499.99,5227
1,adobe creative suite cs3 web standard upsell [ mac ],adobe,799.0,adobe cs3 web standard upsell,,819.99,2860
1,the logo creator ( mac ),laughing bird,39.99,laughingbird the logo creator,,34.99,6653
1,reel deal slots 2.0 for pc,phantom efx,9.99,phantom efx reel deal slots v 2.0,,7.36,5879
1,microsoft office student and teacher edition 2004 macintosh,microsoft,149.99,microsoft office 2004 student/teacher,,145.99,961
1,instant immersion italian deluxe 2.0,topics entertainment,49.99,instant immers italian dlux 2 .,,36.11,4997
1,adobe software acrobat pro upgrd pro-pro mac ( adbcd01798mc ),adobe software,273.0,adobe acrobat v8 .0 professional for mac upgrade,,145.99,1596
1,acrobat professional 8 ( windows ),adobe,273.0,adobe systems inc adobe acrobat 8.0 professional upsell ( std-pro ),,157.36,4539
1,final cut express 2.0 upgrade,apple computer,99.99,apple software m9372z/a final cut express 2.0 upgrade,apple software,79.99,4509
1,apple final cut studio 2 ( mac ),apple,1299.0,apple final cut studio 2,,1299.99,6770
1,apple final cut studio 2 ( mac ),apple,1299.0,apple final cut studio 2 production suite for mac av production software,,1298.95,99
1,apple final cut express hd 3.5 ( mac ),apple computer,299.0,apple final cut express hd 3.5,,299.99,2035
1,elementary school success deluxe 2006,topics entertainment,49.99,elementary school success deluxe 2006,,15.9,2829
1,microsoft windows vista ultimate full version [ dvd ],microsoft,399.95,microsoft windows vista ultimate retail no open box returns,,399.99,3701
1,services for netware 5.0,microsoft,149.0,microsoft windows services for netware v. 5.0 complete package,,138.17,3737
1,peachtree by sage premium accounting for manufacturing 2007 multi user ( up to 5 users ),sage software,1199.99,sage ( ptree ) premium accounting for manufacturing 2007 multi-user,,1180.37,4787
1,peachtree by sage premium accounting 2007 accountants ' edition,sage software,499.99,sage ( ptree ) premium accounting accountants edition 2007,,492.01,4444
1,peachtree by sage complete accounting 2007,sage software,269.99,sage software peachtree complete accounting 2007 software for windows tax & finance software,,249.95,3977
1,adobe creative suite cs3 production premium upgrade,adobe,799.0,production prem cs3 mac upgrad,,808.15,981
1,adobe production studio premium,adobe,1699.0,adobe production studio premium software suite video software bundles,,1698.95,1622
1,adobe audition 2.0,adobe,349.0,adobe audition 2.0 audio production software music production software,,348.95,5854
1,computrace lojack for laptops : 1 year subscription,absolute software,49.99,absolute software lfl-n2-12 computrace lojack for laptops 1 year license ( win 2000 xp ),,41.97,2706
1,computrace lojack for laptops : 3 year subscription,absolute software,99.99,absolute software lfl-n2-36 computrace lojack for laptops 3 year license ( win 2000 xp ),,85.97,1577
1,computrace lojack for laptops 4 year subscription,absolute software,119.99,absolute software lfl-n2-48 computrace lojack for laptops 4 year license,,105.68,1463
1,pinnacle mobile media converter,pinnacle,29.99,pinnacle mobile media converter software for windows ipod software,,29.95,1618
1,adobe captivate 2.0,adobe,1083.95,adobe captivate 2 software for windows presentation software,,598.95,5111
1,quicken 2007 basic,intuit,29.95,intuit quicken basic 2007 software for windows tax & finance software,,29.95,2538
1,quicken 2007 deluxe,intuit,59.95,intuit quicken deluxe 2007 software for windows tax & finance software,,54.95,1518
1,quickbooks pro 2007 small business financial software,intuit,199.95,intuit quickbooks pro 2007 software for windows tax & finance software,,179.95,1954
1,sibelius 5 educational edition,sibelius-software-ltd .,329.0,sibelius sibelius 5 software educational discount music production software,sibelius-software-ltd .,248.95,1845
1,entertainment partners budgeting ( mac ),entertainment partners,699.0,entertainment partners ep budgeting for film,,415.99,6256
1,phonics success essentials : grades 7-9,topics education,19.99,topics entertainment phonics success essentials,,17.55,1313
1,atlantis quest,got game,19.99,got game entertainment atlantis quest,,17.27,827
1,learn2 training for microsoft excel,topics-entertainment-software - ( consignment ),9.99,topics entertainment learn2 training for microsoft excel,topics-entertainment-software - ( consignment ),6.56,6540
1,adobe photoshop elements 5.0 premiere elements 3.0 bundle,adobe,149.99,adobe systems inc 29180248 adobe photoshop elements 5.0 / premiere elements 3.0,,139.51,3330
1,photoshop elements 5 and premiere elements 3 bundle win minibox ( 29180248 ),adobe,242.62,adobe systems inc 29180248 adobe photoshop elements 5.0 / premiere elements 3.0,,139.51,3320
1,adobe premiere elements 3.0,adobe,161.73,adobe premiere elements 3 ( pc ),,99.99,1046
1,adobe premiere elements 3.0,adobe,99.99,adobe premiere elements 3 ( pc ),,99.99,6372
1,quicken legal business pro 2007,nolo press,79.99,nolo quicken legal business pro 2007,,67.94,909
1,palo alto business plan pro 2007,palo-alto-software,99.95,palo alto software business plan pro 2007,palo-alto-software,88.83,292
1,world of rainbow fish,global-software-publishing,19.99,world of rainbow fish ( a9839m2h ),global-software-publishing,19.19,6141
1,pc cillin internet sec 2007 lics large box 3u,trend micro,49.95,pc-cillin internet security 2007 3-user ( win me 2000 xp ),,49.95,2090
1,mcafee total protection 2007 3 users,mcafee,99.99,mcafee inc total protection 2007 3-user,,92.51,648
1,internet security barrier x4 antispam edition,intego inc,,intego inc internet security barrier x4 antispam edition,,71.75,2508
1,upg sgms 1000 incremental node,sonic-systems-inc .,,sonicwall gms 1000 upgrade,,63074.12,2177
1,irispen express translator,iris,149.99,iris inc irispen express translator,,142.29,225
1,microspot interiors,microspot ltd.,99.95,microspot interiors ( mac 10.2 or later ),,99.95,5528
1,adobe photoshop elements 5.0 / premier elements 3.0 [ lb ],adobe,149.99,adobe premiere elements 3 and photoshop elements 5 software for windows consumer video editing software,,149.95,2409
1,photoshop elements 4 mac retail eng 1u ( 19230169 ),adobe,145.39,adobe photoshop elements 4.0 photo-editing software for mac,,85.95,6590
1,photoshop elements 4 edu mac 1u,adobe-education-box,69.0,adobe photoshop elements 4.0 mac academic,adobe-education-box,69.99,2008
1,snap ! spelling ( jewel case ),topics entertainment,19.95,spelling,,4.93,3379
1,netmanage upg rumba unix-hp edition level 902453-007-c ),netmanage,,902453-007-b rumba unix-hp edition upgrade license 1 user volume level b 5-49 c,,147.73,6621
1,panda internet security 2007 3-user,panda software,69.95,panda software panda internet security 2007,,69.99,1422
1,zonealarm pro firewall,zone labs,39.99,zone labs zonealarm pro,,30.17,809
1,norton internet security mac 3.0 [ antivirus firewall privacy controls iclean ],symantec,99.95,symantec norton internet security 3.0 software for macintosh apple & mac software,,89.95,6020
1,zonealarm internet security suite,zone labs,49.99,zonealarm internet security suite 2007 ( pc ) zonelabs,,49.99,5481
1,mediafour macdrive 6 for windows,mediafour corporation,49.99,mediafour macdrive 6 access mac partition in windows,,43.99,3115
1,microsoft office student and teacher edition 2004 macintosh,microsoft,149.99,office mac student/teach 04,,146.02,6015
1,quickbooks premier edition 2007 5 user multi-pack,intuit,1499.95,intuit inc quickbooks premier edition 2007 5 user,,1309.31,3654
1,quicken 2007 for mac,intuit,69.95,intuit quicken 2007 macintosh,,69.99,5130
1,quicken 2007 premier,intuit,79.95,intuit quicken premier 2007 software for windows tax & finance software,,73.95,6869
1,national geographic presents : redshift 5 planetarium software,topics entertainment,39.99,redshift 5 ( national geographic presents ) ( win 98 me 2000 xp ),,39.99,4137
1,national geographic photo gallery ( jewel case ),topics entertainment,9.99,national geographic photo gallery topics,,9.95,3061
1,national geographic presents : forces of nature,topics entertainment,29.99,national geographic : forces of nature,,12.9,3276
1,riverdeep the print shop zoom dvd,riverdeep,,encore software 11941 the print shop zoom,,17.97,300
1,the print shop 22 deluxe,encore,49.99,the printshop v22 deluxe,,29.9,3655
1,the print shop 22 deluxe sb cs by the print shop,encore software,49.95,encore software 10741 the print shop 22 deluxe sb cs by the print shop,,42.97,1943
1,cosmi rom03558 print perfect clip art deluxe,cosmi,,cosmi print perfect clip art deluxe,,6.99,3374
1,norton antivirus 2007,symantec,39.99,symantec norton anti-virus 2007 windows,,39.99,5777
1,panda antivirus 2007,panda software,29.95,sos aggregation company panda antivirus 2007,,23.72,6528
1,adobe soundbooth cs3 [ mac ],adobe,199.0,adobe soundbooth cs3 audio editing software mac music production software,,198.95,3055
1,power production storyboard quick,power production,,power production storyboard quick 5 software for mac and windows animation software,,299.0,6713
1,power production storyboard artist 4,power production,,power production power production storyboard artist software animation software,,498.95,6004
1,adobe after effects 7.0 professional ( mac ),adobe,999.0,adobe after effects professional 7.0 software effects software,,998.95,108
1,rollercoaster tycoon 3 ( mac ),aspyr media,49.99,aspyr roller coaster tycoon 3 mac os x,,45.99,800
1,rollercoaster tycoon 3 : soaked,aspyr media,19.99,rollercoaster tycoon 3 soaked,,23.99,3245
