label,ltable_title,ltable_authors,ltable_venue,ltable_year,rtable_title,rtable_authors,rtable_venue,rtable_year,id
1,form-based proxy caching for database-backed web sites,"jeffrey f. naughton , qiong luo",vldb,2001,form-based proxy caching for database-backed web sites,"qiong luo , jeffrey f. naughton",very large data bases,2001,6422
1,middle-tier database caching for e-business,"hamid pirahesh , c. mohan , jeffrey f. naughton , sailesh krishnamurthy , honguk woo , qiong luo , bruce g. lindsay",sigmod conference,2002,middle-tier database caching for e-business,"qiong luo , sailesh krishnamurthy , c. mohan , hamid pirahesh , honguk woo , bruce g. lindsay , jeffrey f. naughton",international conference on management of data,2002,2426
1,building scalable internet applications with oracle8i server,"olga peschansky , josé alberto fernández , julie basu",vldb,2000,building scalable internet applications with oracle8i server,"julie basu , jos &#233; alberto fern &#225; ndez , olga peschansky",very large data bases,2000,2766
1,a transaction replication scheme for a replicated database with node autonomy,"david wai-lok cheung , ada wai-chee fu",vldb,1994,a transaction replication scheme for a replicated database with node autonomy,"ada wai-chee fu , david wai-lok cheung",very large data bases,1994,2480
1,web caching for database applications with oracle web cache,"jordan parker , jesse anton , zheng zeng , lawrence jacobs , tie zhong , xiang liu",sigmod conference,2002,web caching for database applications with oracle web cache,"jesse anton , lawrence jacobs , xiang liu , jordan parker , zheng zeng , tie zhong",international conference on management of data,2002,1043
1,"storhouse metanoia - new applications for database , storage & data warehousing","felipe cariño , pekka kostamaa , art kaufmann , john burgess",sigmod conference,2001,"storhouse metanoia - new applications for database , storage & ; data warehousing","felipe cari &#241; o , jr. , pekka kostamaa , art kaufmann , john burgess",international conference on management of data,2001,7000
1,objectivity industrial exhibit,objectivity,vldb,1998,objectivity industrial exhibit,objectivity,very large data bases,1998,648
1,oracle industrial exhibit,amy pogue,vldb,1998,oracle industrial exhibit,amy pogue,very large data bases,1998,2301
1,amalgamating knowledge bases,v. s. subrahmanian,acm trans . database syst .,1994,amalgamating knowledge bases,v. s. subrahmanian,acm transactions on database systems ( tods ),1994,7046
1,efficient optimistic concurrency control using loosely synchronized clocks,"barbara liskov , atul adya , robert gruber , umesh maheshwari",sigmod conference,1995,efficient optimistic concurrency control using loosely synchronized clocks,"atul adya , robert gruber , barbara liskov , umesh maheshwari",international conference on management of data,1995,1573
1,efficient concurrency control for broadcast environments,"arvind nithrakashyap , rajendran m. sivasankaran , jayavel shanmugasundaram , krithi ramamritham",sigmod conference,1999,efficient concurrency control for broadcast environments,"jayavel shanmugasundaram , arvind nithrakashyap , rajendran sivasankaran , krithi ramamritham",international conference on management of data,1999,6793
1,unisql/x unified relational and object-oriented database system,won kim,sigmod conference,1994,unisql/x unified relational and object-oriented database system,won kim,international conference on management of data,1994,3557
1,an effective deductive object-oriented database through language integration,"m. howard williams , norman w. paton , andrew dinn , maria l. barja , alvaro a. a. fernandes",vldb,1994,an effective deductive object-oriented database through language integration,"maria l. barja , norman w. paton , alvaro a. a. fernandes , m. howard williams , andrew dinn",very large data bases,1994,3994
1,odefs : a file system interface to an object-oriented database,"narain h. gehani , william d. roome , h. v. jagadish",vldb,1994,odefs : a file system interface to an object-oriented database,"narain h. gehani , h. v. jagadish , william d. roome",very large data bases,1994,5503
1,semcog : an object-based image retrieval system and its visual query interface,"k. selçuk candan , wen-syan li , kyoji hirata , yoshinori hara",sigmod conference,1997,semcog : an object-based image retrieval system and its visual query interface,"wen-syan li , k. sel &#231; uk candan , kyoji hirata , yoshinori hara",international conference on management of data,1997,2154
1,the persistent cache : improving oid indexing in temporal object-oriented database systems,kjetil nørvåg,vldb,1999,the persistent cache : improving oid indexing in temporal object-oriented database systems,kjetil n &#248; rv &#229; g,very large data bases,1999,1381
1,a cost model for clustered object-oriented databases,"zhao-hui tang , jean-robert gruser , georges gardarin",vldb,1995,a cost model for clustered object-oriented databases,"georges gardarin , jean-robert gruser , zhao-hui tang",very large data bases,1995,4397
1,query unnesting in object-oriented databases,leonidas fegaras,sigmod conference,1998,query unnesting in object-oriented databases,leonidas fegaras,international conference on management of data,1998,3650
1,emergent semantics and the multimedia semantic web,"william i. grosky , farshad fotouhi , d. v. sreenath",sigmod record,2002,emergent semantics and the multimedia semantic web,"w. i. grosky , d. v. sreenath , f. fotouhi",acm sigmod record,2002,2406
1,managing multiple and distributed ontologies on the semantic web,"boris motik , alexander maedche , ljiljana stojanovic",vldb j.,2003,managing multiple and distributed ontologies on the semantic web,"a. maedche , b. motik , l. stojanovic",the vldb journal -- the international journal on very large data bases,2003,612
1,"agents , turst , and information access on the semantic web","timothy w. finin , anupam joshi",sigmod record,2002,"agents , trust , and information access on the semantic web","tim finin , anupam joshi",acm sigmod record,2002,3053
1,strudel : a web-site management system,"alon y. levy , mary f. fernandez , jaewoo kang , daniela florescu , dan suciu",sigmod conference,1997,strudel : a web site management system,"mary fernandez , daniela florescu , jaewoo kang , alon levy , dan suciu",international conference on management of data,1997,4232
1,the araneus web-base management system,"giansalvatore mecca , paolo merialdo , alessandro masci , paolo atzeni , giuseppe sindoni",sigmod conference,1998,the araneus web-based management system,"g. mecca , p. atzeni , a. masci , g. sindoni , p. merialdo",international conference on management of data,1998,334
1,aurora : a data stream management system,"nesime tatbul , daniel j. abadi , c. erwin , anurag maskey , mitch cherniack , alex rasin , christian convey , a. singer , eduardo f. galvez , r. yan , ugur çetintemel , ying xing , stanley b. zdonik , michael stonebraker , donald carney , m. hatoun",sigmod conference,2003,aurora : a data stream management system,"d. abadi , d. carney , u. &#199; etintemel , m. cherniack , c. convey , c. erwin , e. galvez , m. hatoun , a. maskey , a. rasin , a. singer , m. stonebraker , n. tatbul , y. xing , r. yan , s. zdonik",international conference on management of data,2003,1561
1,the mariposa distributed database management system,jeff sidell,sigmod record,1996,the mariposa distributed database management system,jeff sidell,acm sigmod record,1996,3991
1,tigukat : a uniform behavioral objectbase management system,"randal j. peters , m. tamer özsu , boman irani , adriana muñoz , anna lipka , duane szafron",vldb j.,1995,tigukat : a uniform behavioral objectbase management system,"m. tamer &#214; zsu , randal peters , duane szafron , boman irani , anna lipka , adriana mu &#241; oz",the vldb journal -- the international journal on very large data bases,1995,2623
1,dynamat : a dynamic view management system for data warehouses,"nick roussopoulos , yannis kotidis",sigmod conference,1999,dynamat : a dynamic view management system for data warehouses,"yannis kotidis , nick roussopoulos",international conference on management of data,1999,4606
1,dyda : data warehouse maintenance in fully concurrent environments,"songting chen , andreas koeller , elke a. rundensteiner , xin zhang , jun chen",sigmod conference,2001,dyda : data warehouse maintenance in fully concurrent environments,"jun chen , xin zhang , songting chen , andreas koeller , elke a. rundensteiner",international conference on management of data,2001,5525
1,database management systems and the internet,susan malaika,vldb,1996,database management systems and the internet,susan malaika,very large data bases,1996,1199
1,query processing techniques for arrays,"kenneth salem , arunprasad p. marathe",sigmod conference,1999,query processing techniques for arrays,"arunprasad p. marathe , kenneth salem",international conference on management of data,1999,3166
1,applying data mining techniques to a health insurance information system,"michael j. rothman , john p. nearhos , marisa s. viveros",vldb,1996,applying data mining techniques to a health insurance information system,"marisa s. viveros , john p. nearhos , michael j. rothman",very large data bases,1996,4079
1,extracting schema from semistructured data,"serge abiteboul , rajeev motwani , svetlozar nestorov",sigmod conference,1998,extracting schema from semistructured data,"svetlozar nestorov , serge abiteboul , rajeev motwani",international conference on management of data,1998,1551
1,modelling and querying video data,"rune hjelsvold , roger midtstraum",vldb,1994,modelling and querying video data,"rune hjelsvold , roger midtstraum",very large data bases,1994,3203
1,infering structure in semistructured data,"rajeev motwani , serge abiteboul , svetlozar nestorov",sigmod record,1997,inferring structure in semistructured data,"svetlozer nestorov , serge abiteboul , rajeev motwani",acm sigmod record,1997,6280
1,querying structured text in an xml database,"h. v. jagadish , shurug al-khalifa , cong yu",sigmod conference,2003,querying structured text in an xml database,"shurug al-khalifa , cong yu , h. v. jagadish",international conference on management of data,2003,1236
1,describing semistructured data,luca cardelli,sigmod record,2001,describing semistructured data,luca cardelli,acm sigmod record,2001,3159
1,query rewriting for semistructured data,"vasilis vassalos , yannis papakonstantinou",sigmod conference,1999,query rewriting for semistructured data,"yannis papakonstantinou , vasilis vassalos",international conference on management of data,1999,1334
1,foreword : management of semistructured data,dan suciu,sigmod record,1997,management of semistructured data,dan suciu,acm sigmod record,1997,5779
1,semistructured und structured data in the web : going back and forth,"paolo merialdo , giansalvatore mecca , paolo atzeni",sigmod record,1997,semistructured and structured data in the web : going back and forth,"paolo atzeni , giansalvatore mecca , paolo merialdo",acm sigmod record,1997,1876
1,a fast index for semistructured data,"brian cooper , gísli r. hjaltason , michael j. franklin , neal sample , moshe shadmon",vldb,2001,a fast index for semistructured data,"brian cooper , neal sample , michael j. franklin , gisli r. hjaltason , moshe shadmon",very large data bases,2001,1009
1,constraints for semi-structured data and xml,"wenfei fan , peter buneman , scott weinstein , jérôme siméon",sigmod record,2001,constraints for semistructured data and xml,"peter buneman , wenfei fan , j &#233; r &#244; me sim &#233; on , scott weinstein",acm sigmod record,2001,2586
1,vqbd : exploring semistructured data,"jihwang yeo , sudarshan s. chawathe , thomas baby",sigmod conference,2001,vqbd : exploring semistructured data,"sudarshan s. chawathe , thomas baby , jihwang yoo",international conference on management of data,2001,2944
1,"research and practice in federated information systems , report of the efis ' 2000 international workshop","ralf-detlef kutsche , geert-jan houben , mark roantree , bodo rieger , wilhelm hasselbring , kazimierz subieta , willem-jan van den heuvel",sigmod record,2000,research and practice in federated information systems,"w. hasselbring , w.-j . van den heuvel , g. j. houben , r.-d . kutsche , b. rieger , m. roantree , k. subieta",acm sigmod record,2000,5338
1,solving satisfiability and implication problems in database systems,"sha guo , mark allen weiss , wei sun",acm trans . database syst .,1996,solving satisfiability and implication problems in database systems,"sha guo , wei sun , mark a. weiss",acm transactions on database systems ( tods ),1996,6889
1,advances in databases and information systems ( adbis ),"albertas caplinskas , johann eder , olegas vasilecas",sigmod record,2002,advances in databases and information systems : report of 5th east european conference adbis ' 2001,"albertas caplinskas , johann eder , olegas vasilecas",acm sigmod record,2002,7294
1,the ecobase project : database and web technologies for environmental information systems,"asterio k. tanaka , patrick valduriez",sigmod record,2001,the ecobase project : database and web technologies for environmental information systems,"luc bouganim , maria claudia cavalcanti , fran &#231; oise fabret , maria luiza campos , fran &#231; ois llirbat , marta mattoso , rubens melo , ana maria moura , esther pacitti , fabio porto , margareth simoes , eric simon , asterio tanaka , patrick valduriez",acm sigmod record,2001,2392
1,environment information systems - guest editor 's foreword,oliver günther,sigmod record,1997,environmental information systems,oliver g &#252; nther,acm sigmod record,1997,1296
1,"calibrating the query optimizer cost model of iro-db , an object-oriented federated database system","zhao-hui tang , fei sha , georges gardarin",vldb,1996,"calibrating the query optimizer cost model of iro-db , an object-oriented federated database system","georges gardarin , fei sha , zhao-hui tang",very large data bases,1996,1223
1,evaluating functional joins along nested reference sets in object-relational and object-oriented databases,"alfons kemper , reinhard braumandl , jens claußen",vldb,1998,evaluating functional joins along nested reference sets in object-relational and object-oriented databases,"reinhard braumandl , jens clau &#223; en , alfons kemper",very large data bases,1998,4406
1,procedures in object-oriented query languages,"kazimierz subieta , jacek leszczylowski , yahiko kambayashi",vldb,1995,procedures in object-oriented query languages,"kazimierz subieta , yahiko kambayashi , jacek leszczylowski",very large data bases,1995,6143
1,the ccube constraint object-oriented database system,"alexander brodsky , pavel a. exarkhopoulo , victor e. segal , jia chen",sigmod conference,1999,the ccube constraint object-oriented database system,"alexander brodsky , victor e. segal , jia chen , paval a. exarkhopoulo",international conference on management of data,1999,1515
1,optimizing queries with universal quantification in object-oriented and object-relational databases,"guido moerkotte , jens claußen , klaus peithner , alfons kemper",vldb,1997,optimizing queries with universal quantification in object-oriented and object-relational databases,"jens clau &#223; en , alfons kemper , guido moerkotte , klaus peithner",very large data bases,1997,2764
1,metu object-oriented dbms,"cetin ozkan , cem evrendilek , yuksel saygin , ilker altintas , ismailcem budak arpinar , mehmet altinel , tansel okay , ilker durusoy , asuman dogac",sigmod conference,1994,metu object-oriented dbms,"asuman dogac , budak arpinar , cem evrendilek , cetin ozkan , ilker altintas , ilker durusoy , mehmet altinel , tansel okay , yuksel saygin",international conference on management of data,1994,1102
1,description logics for semantic query optimization in object-oriented database systems,"claudio sartori , sonia bergamaschi , domenico beneventano",acm trans . database syst .,2003,description logics for semantic query optimization in object-oriented database systems,"domenico beneventano , sonia bergamaschi , claudio sartori",acm transactions on database systems ( tods ),2003,1763
1,managing intervals efficiently in object-relational databases,"thomas seidl , marco pötke , hans-peter kriegel",vldb,2000,managing intervals efficiently in object-relational databases,"hans-peter kriegel , marco p &#246; tke , thomas seidl",very large data bases,2000,4202
1,design and user testing of a multi-paradigm query interface to an object-oriented database,"dac khoa doan , alistair c. kilgour , norman w. paton",sigmod record,1995,design and user testing of a multi-paradigm query interface to an object-oriented database,"dac khoa doan , norman w. paton , alistair kilgour",acm sigmod record,1995,6564
1,investigating xquery for querying across database object types,nancy wiegand,sigmod record,2002,investigating xquery for querying across database object types,nancy wiegand,acm sigmod record,2002,4325
1,the hcc-tree : an efficient index structure for object oriented databases,"b. sreenath , s. seshadri",vldb,1994,the hcc-tree : an efficient index structure for object oriented databases,"b. sreenath , s. seshadri",very large data bases,1994,2913
1,the trigs active object-oriented database system - an overview,"gerti kappel , werner retschitzegger",sigmod record,1998,the trigs active object-oriented database system - an overview,"g. kappel , w. retschitzegger",acm sigmod record,1998,1459
1,join index hierarchies for supporting efficient navigations in object-oriented databases,"jiawei han , zhaohui xie",vldb,1994,join index hierarchies for supporting efficient navigations in object-oriented databases,"zhaohui xie , jiawei han",very large data bases,1994,217
1,opt + + : an object-oriented implementation for extensible database query optimization,"david j. dewitt , navin kabra",vldb j.,1999,opt + + : an object-oriented implementation for extensible database query optimization,"navin kabra , david j. dewitt",the vldb journal -- the international journal on very large data bases,1999,637
1,garbage collection in object-oriented databases using transactional cyclic reference counting,"s. sudarshan , prasan roy , abraham silberschatz , srinivas ashwin , s. seshadri",vldb j.,1998,garbage collection in object-oriented databases using transactional cyclic reference counting,"p. roy , s. seshadri , a. silberschatz , s. sudarshan , s. ashwin",the vldb journal -- the international journal on very large data bases,1998,6090
1,data management for pervasive computing,"mitch cherniack , stanley b. zdonik , michael j. franklin",vldb,2001,data management for pervasive computing,"mitch cherniack , michael j. franklin , stanley b. zdonik",very large data bases,2001,5758
1,databases and transaction processing : an application-oriented approach - book review,alfons kemper,sigmod record,2002,databases and transaction processing : an application-oriented approach,"philip m. lewis , arthur bernstein , michael kifer",acm sigmod record,2002,163
1,applying update streams in a soft real-time database system,"brad adelberg , hector garcia-molina , ben kao",sigmod conference,1995,applying update streams in a soft real-time database system,"b. adelberg , h. garcia-molina , b. kao",international conference on management of data,1995,2816
1,deeds towards a distributed and active real-time database system,"joakim eriksson , jonas mellin , sten andler , mikael berndtsson , bengt eftring , jörgen hansson",sigmod record,1996,deeds towards a distributed and active real-time database system,"s. f. andler , j. hansson , j. eriksson , j. mellin , m. berndtsson , b. eftring",acm sigmod record,1996,1029
1,enhancing external consistency in real-time transactions,"shing-shan peng , kwei-jay lin",sigmod record,1996,enhancing external consistency in real-time transactions,"kwei-jay lin , ching-shan peng",acm sigmod record,1996,813
1,enterprise transaction processing on windows nt,greg hope,sigmod conference,1995,enterprise transaction processing on windows nt,greg hope,international conference on management of data,1995,5698
1,transaction timestamping in ( temporal ) databases,"christian s. jensen , david b. lomet",vldb,2001,transaction timestamping in ( temporal ) databases,"christian s. jensen , david b. lomet",very large data bases,2001,4033
1,improving timeliness in real-time secure database systems,"sang hyuk son , rasikan david , bhavani m. thuraisingham",sigmod record,1996,improving timeliness in real-time secure database systems,"sang h. son , rasikan david , bhavani thuraisingham",acm sigmod record,1996,4231
1,query optimization in compressed database systems,"zhiyuan chen , flip korn , johannes gehrke",sigmod conference,2001,query optimization in compressed database systems,"zhiyuan chen , johannes gehrke , flip korn",international conference on management of data,2001,4951
1,dbminer : interactive mining of multiple-level knowledge in relational databases,"wei wang , krzysztof koperski , yongjian fu , osmar r. zaïane , jenny chiang , jiawei han",sigmod conference,1996,dbminer : interactive mining of multiple-level knowledge in relational databases,"jaiwei han , youngjian fu , wei wang , jenny chiang , osmar r. za &#239; ane , krzysztof koperski",international conference on management of data,1996,6588
1,dbxplorer : enabling keyword search over relational databases,"gautam das , sanjay agrawal , surajit chaudhuri",sigmod conference,2002,dbxplorer : enabling keyword search over relational databases,"sanjay agrawal , surajit chaudhuri , gautam das",international conference on management of data,2002,3920
1,querying multiple features of groups in relational databases,"damianos chatziantoniou , kenneth a. ross",vldb,1996,querying multiple features of groups in relational databases,"damianos chatziantoniou , kenneth a. ross",very large data bases,1996,6883
1,java and relational databases : sqlj ( tutorial ),"johannes klein , richard pledereder , gray clossman , brian becker , phil shaw , mark hapner",sigmod conference,1998,java and relational databases ( tutorial ) : sqlj,"gray clossman , phil shaw , mark hapner , johannes klein , richard pledereder , brian becker",international conference on management of data,1998,5175
1,declarative updates of relational databases,weidong chen,acm trans . database syst .,1995,declarative updates of relational databases,weidong chen,acm transactions on database systems ( tods ),1995,6190
1,a taxonomy for secure object-oriented databases,"sebastiaan h. von solms , martin s. olivier",acm trans . database syst .,1994,a taxonomy for secure object-oriented databases,"martin s. olivier , sebastiaan h. von solms",acm transactions on database systems ( tods ),1994,6000
1,odmg-93 : a standard for object-oriented dbmss,r. g. g. cattell,sigmod conference,1994,odmg-93 : a standard for object-oriented dbmss,r. g. g. cattell,international conference on management of data,1994,6356
1,a database model for object dynamics,"mike p. papazoglou , bernd j. krämer",vldb j.,1997,a database model for object dynamics,"m. p. papazoglou , b. j. kr &#228; mer",the vldb journal -- the international journal on very large data bases,1997,4444
1,cost-based selection of path expression processing algorithms in object-oriented databases,"zhao-hui tang , georges gardarin , jean-robert gruser",vldb,1996,cost-based selection of path expression processing algorithms in object-oriented databases,"georges gardarin , jean-robert gruser , zhao-hui tang",very large data bases,1996,6039
1,structures for manipulating proposed updates in object-oriented databases,"richard hull , mohammed rupawalla , michael doherty",sigmod conference,1996,structures for manipulating proposed updates in object-oriented databases,"michael doherty , richard hull , mohammed rupawalla",international conference on management of data,1996,1207
1,a data model and data structures for moving objects databases,"markus schneider , enrico nardelli , luca forlizzi , ralf hartmut güting",sigmod conference,2000,a data model and data structures for moving objects databases,"luca forlizzi , ralf hartmut g &#252; ting , enrico nardelli , markus schneider",international conference on management of data,2000,474
1,an experimental system for object-based sharing in federated databases,"shahram ghandeharizadeh , doug fang",vldb j.,1996,an experimental object-based sharing system for networked databases,"doug fang , shahram ghandeharizadeh , dennis mcleod",the vldb journal -- the international journal on very large data bases,1996,4779
1,observations on the odmg-93 proposal,won kim,sigmod record,1994,observations on the odmg-93 proposal for an object-oriented database language,won kim,acm sigmod record,1994,5315
1,an efficient method for checking object-oriented database schema correctness,"michele missikoff , anna formica , hans dietmar gröger",acm trans . database syst .,1998,an efficient method for checking object-oriented database schema correctness,"a. formica , h. d. groger , m. missikoff",acm transactions on database systems ( tods ),1998,1920
1,materialized views and data warehouses,nick roussopoulos,sigmod record,1998,materialized views and data warehouses,nick roussopoulos,acm sigmod record,1998,606
1,what is the data warehousing problem ? ( are materialized views the answer ? ),"inderpal singh mumick , ashish gupta",vldb,1996,what is the data warehousing problem ? ( are materialized views the answer ? ),"ashish gupta , inderpal singh mumick",very large data bases,1996,5924
1,"enterprise objects framework , a second generation object-relational enabler",charly kleissner,sigmod conference,1995,enterprise objects framework : a second generation object-relational enabler,charly kleissner,international conference on management of data,1995,1611
