label,ltable_title,ltable_authors,ltable_venue,ltable_year,rtable_title,rtable_authors,rtable_venue,rtable_year,id
1,re-designing distance functions and distance-based applications for high dimensional data,charu c. aggarwal,sigmod record,2001,re-designing distance functions and distance-based applications for high dimensional data,charu c. aggarwal,acm sigmod record,2001,6122
1,conceptual schema analysis : techniques and applications,"valeria de antonellis , barbara pernici , maria grazia fugini , silvana castano",acm trans . database syst .,1998,conceptual schema analysis : techniques and applications,"s. castano , v. de antonellis , m. g. fugini , b. pernici",acm transactions on database systems ( tods ),1998,3958
1,psoup : a system for streaming queries over streaming data,"sirish chandrasekaran , michael j. franklin",vldb j.,2003,psoup : a system for streaming queries over streaming data,"sirish chandrasekaran , michael j. franklin",the vldb journal -- the international journal on very large data bases,2003,4457
1,datablitz : a high performance main-memory storage manager,"p. p. s. narayan , s. joshi , m. nemeth , abraham silberschatz , henry f. korth , a. khivesera , jerry baulier , s. sudarshan , philip bohannon , peter mcilroy , j. miller , s. gogate , rajeev rastogi , c. gupta",vldb,1998,datablitz : a high performance main-memory storage manager,"jerry baulier , philip bohannon , s. gogate , s. joshi , c. gupta , a. khivesera , henry f. korth , peter mcilroy , j. miller , p. p. s. narayan , m. nemeth , rajeev rastogi , abraham silberschatz , s. sudarshan",very large data bases,1998,907
1,xmas : an extensible main-memory storage system for high-performance applications,"ki hong kim , yong sik kwon , sang kyun cha , jang ho park , byoung dae park , sangho lee",sigmod conference,1998,xmas : an extensible main-memory storage system for high-performance applications,"jang ho park , yong sik kwon , ki hong kim , sang ho lee , byoung dae park , sang kyun cha",international conference on management of data,1998,4708
1,dalí : a high performance main memory storage manager,"s. sudarshan , h. v. jagadish , rajeev rastogi , abraham silberschatz , daniel f. lieuwen",vldb,1994,dali : a high performance main memory storage manager,"h. v. jagadish , daniel f. lieuwen , rajeev rastogi , abraham silberschatz , s. sudarshan",very large data bases,1994,1141
1,algorithms for deferred view maintenance,"leonid libkin , inderpal singh mumick , latha s. colby , howard trickey , timothy griffin",sigmod conference,1996,algorithms for deferred view maintenance,"latha s. colby , timothy griffin , leonid libkin , inderpal singh mumick , howard trickey",international conference on management of data,1996,1808
1,performance issues in incremental warehouse maintenance,"hector garcia-molina , wilburt labio , yingwei cui , jennifer widom , jun yang",vldb,2000,performance issues in incremental warehouse maintenance,"wilburt labio , jun yang , yingwei cui , hector garcia-molina , jennifer widom",very large data bases,2000,2799
1,on-line warehouse view maintenance,"jennifer widom , dallan quass",sigmod conference,1997,on-line warehouse view maintenance,"dallan quass , jennifer widom",international conference on management of data,1997,4306
1,efficient and cost-effective techniques for browsing and indexing large video databases,"kien a. hua , jung-hwan oh",sigmod conference,2000,efficient and cost-effective techniques for browsing and indexing large video databases,"junghwan oh , kien a. hua",international conference on management of data,2000,5051
1,efficient and effective metasearch for text databases incorporating linkages among documents,"weiyi meng , clement t. yu , king-lup liu , wensheng wu",sigmod conference,2001,efficient and effective metasearch for text databases incorporating linkages among documents,"clement yu , weiyi meng , wensheng wu , king-lup liu",international conference on management of data,2001,5810
1,efficient dynamic mining of constrained frequent sets,"laks v. s. lakshmanan , raymond t. ng , carson kai-sang leung",acm trans . database syst .,2003,efficient dynamic mining of constrained frequent sets,"laks v. s. lakshmanan , carson kai-sang leung , raymond t. ng",acm transactions on database systems ( tods ),2003,3875
1,optimization of constrained frequent set queries with 2-variable constraints,"laks v. s. lakshmanan , alex pang , raymond t. ng , jiawei han",sigmod conference,1999,optimization of constrained frequent set queries with 2-variable constraints,"laks v. s. lakshmanan , raymond ng , jiawei han , alex pang",international conference on management of data,1999,6713
1,optimization techniques for queries with expensive methods,joseph m. hellerstein,acm trans . database syst .,1998,optimization techniques for queries with expensive methods,joseph m. hellerstein,acm transactions on database systems ( tods ),1998,3789
1,introduction to constraint databases - book review,bart kuijpers,sigmod record,2002,introduction to constraint databases,bart kuijpers,acm sigmod record,2002,4668
1,roadrunner : automatic data extraction from data-intensive web sites,"giansalvatore mecca , valter crescenzi , paolo merialdo",sigmod conference,2002,roadrunner : automatic data extraction from data-intensive web sites,"valter crescenzi , giansalvatore mecca , paolo merialdo",international conference on management of data,2002,7225
1,design principles for data-intensive web sites,"piero fraternali , stefano paraboschi , stefano ceri",sigmod record,1999,design principles for data-intensive web sites,"stefano ceri , piero fraternali , stefano paraboschi",acm sigmod record,1999,6703
1,aurora : a new model and architecture for data stream management,"christian convey , sangdon lee , ugur çetintemel , daniel j. abadi , michael stonebraker , mitch cherniack , donald carney , stanley b. zdonik , nesime tatbul",vldb j.,2003,aurora : a new model and architecture for data stream management,"daniel j. abadi , don carney , ugur &#199; etintemel , mitch cherniack , christian convey , sangdon lee , michael stonebraker , nesime tatbul , stan zdonik",the vldb journal -- the international journal on very large data bases,2003,5656
1,3d geographic network displays,"taosong he , stephen g. eick , kenneth c. cox",sigmod record,1996,3d geographic network displays,"kenneth c. cox , stephen g. eick , taosong he",acm sigmod record,1996,4198
1,exploratory mining via constrained frequent set queries,"jiawei han , teresa mah , laks v. s. lakshmanan , raymond t. ng",sigmod conference,1999,exploratory mining via constrained frequent set queries,"raymond ng , laks v. s. lakshmanan , jiawei han , teresa mah",international conference on management of data,1999,183
1,"data mining using two-dimensional optimized accociation rules : scheme , algorithms , and visualization","shinichi morishita , yasuhiko morimoto , takeshi tokuyama , takeshi fukuda",sigmod conference,1996,"data mining using two-dimensional optimized association rules : scheme , algorithms , and visualization","takeshi fukuda , yasukiko morimoto , shinichi morishita , takeshi tokuyama",international conference on management of data,1996,6552
1,progressive evaluation of nested aggregate queries,"cheng hian goh , beng chin ooi , kian-lee tan",vldb j.,2000,progressive evaluation of nested aggregate queries,"kian-lee tan , cheng hian goh , beng chin ooi",the vldb journal -- the international journal on very large data bases,2000,2257
1,aggregate-query processing in data warehousing environments,"venky harinarayan , dallan quass , ashish gupta",vldb,1995,aggregate-query processing in data warehousing environments,"ashish gupta , venky harinarayan , dallan quass",very large data bases,1995,2731
1,on computing correlated aggregates over continual data streams,"divesh srivastava , flip korn , johannes gehrke",sigmod conference,2001,on computing correlated aggregates over continual data streams,"johannes gehrke , flip korn , divesh srivastava",international conference on management of data,2001,6329
1,aqua : a fast decision support systems using approximate query answers,"swarup acharya , phillip b. gibbons , viswanath poosala",vldb,1999,aqua : a fast decision support systems using approximate query answers,"swarup acharya , phillip b. gibbons , viswanath poosala",very large data bases,1999,1470
1,book review column,karl aberer,sigmod record,2002,book review column,karl aberer,acm sigmod record,2002,7364
1,the design of a retrieval technique for high-dimensional data on tertiary storage,"ratko orlandic , craig swietlik , jack lukaszuk",sigmod record,2002,the design of a retrieval technique for high-dimensional data on tertiary storage,"ratko orlandic , jack lukaszuk , craig swietlik",acm sigmod record,2002,1584
1,d ( k ) - index : an adaptive structural summary for graph-structured data,"chen qun , andrew lim , kian win ong",sigmod conference,2003,d ( k ) - index : an adaptive structural summary for graph-structured data,"qun chen , andrew lim , kian win ong",international conference on management of data,2003,6107
1,"high-dimensional index structures , database support for next decade 's applications ( tutorial )","daniel a. keim , stefan berchtold",sigmod conference,1998,high-dimensional index structures database support for next decade 's applications ( tutorial ),"stefan berchtold , daniel a. keim",international conference on management of data,1998,216
1,a flexible and recoverable client/server database event notification system,"chun xu , eric n. hanson , roxana dastur , i.-cheng chen , vijay ramaswamy , wendy tan , kurt engel",vldb j.,1998,a flexible and recoverable client/server database event notification system,"eric n. hanson , i.-cheng chen , roxana dastur , kurt engel , vijay ramaswamy , wendy tan , chun xu",the vldb journal -- the international journal on very large data bases,1998,1007
1,extracting entity profiles from semistructured information spaces,"robert a. nado , scott b. huffman",sigmod record,1997,extracting entity profiles from semistructured information spaces,"robert a. nado , scott b. huffman",acm sigmod record,1997,2432
1,"design , implementation , and performance of the lham log-structured history data access method","gerhard weikum , peter muth , patrick e. o'neil , achim pick",vldb,1998,"design , implementation , and performance of the lham log-structured history data access method","peter muth , patrick e. o'neil , achim pick , gerhard weikum",very large data bases,1998,7097
1,a cost model for query processing in high dimensional data spaces,christian böhm,acm trans . database syst .,2000,a cost model for query processing in high dimensional data spaces,christian b &#246; hm,acm transactions on database systems ( tods ),2000,4980
1,object-oriented extensions in sql3 : a status report,krishna g. kulkarni,sigmod conference,1994,object-oriented extensions in sql3 : a status report,krishna g. kulkarni,international conference on management of data,1994,5279
1,formal query languages for secure relational databases,"marianne winslett , kenneth smith , xiaolei qian",acm trans . database syst .,1994,formal query languages for secure relational databases,"marianne winslett , kenneth smith , xiaolei qian",acm transactions on database systems ( tods ),1994,6618
1,interviso : dealing with the complexity of federated database access,"edward maros , darrel j. van buer , marjorie templeton , herbert henley",vldb j.,1995,interviso : dealing with the complexity of federated database access,"marjorie templeton , herbert henley , edward maros , darrel j. van buer",the vldb journal -- the international journal on very large data bases,1995,3925
1,the database group at university of hagen ( fernuniversitaet ),"silke mittrach , gunter schlageter , thomas berkel , andreas scherer , eberhard heuel , wolfgang wilkes",sigmod record,1995,the database group at university of hagen,"gunter schlageter , thomas berkel , eberhard heuel , silke mittrach , andreas scherer , wolfgang wilkes",acm sigmod record,1995,649
1,integrating reliable memory in databases,"peter m. chen , wee teck ng",vldb,1997,integrating reliable memory in databases,"wee teck ng , peter m. chen",very large data bases,1997,5665
1,integrating reliable memory in databases,"peter m. chen , wee teck ng",vldb j.,1998,integrating reliable memory in databases,"wee teck ng , peter m. chen",the vldb journal -- the international journal on very large data bases,1998,1654
1,efficient snapshot differential algorithms for data warehousing,"hector garcia-molina , wilburt labio",vldb,1996,efficient snapshot differential algorithms for data warehousing,"wilburt labio , hector garcia-molina",very large data bases,1996,2485
1,efficient algorithms for mining outliers from large data sets,"kyuseok shim , sridhar ramaswamy , rajeev rastogi",sigmod conference,2000,efficient algorithms for mining outliers from large data sets,"sridhar ramaswamy , rajeev rastogi , kyuseok shim",international conference on management of data,2000,3843
1,eddies : continuously adaptive query processing,"ron avnur , joseph m. hellerstein",sigmod conference,2000,eddies : continuously adaptive query processing,"ron avnur , joseph m. hellerstein",international conference on management of data,2000,1859
1,structural matching and discovery in document databases,"jason tsong-li wang , george jyh-shian chang , dennis shasha , girish patel , kaizhong zhang , liam relihan",sigmod conference,1997,structural matching and discovery in document databases,"jason tsong-li wang , dennis shasha , george j. s. chang , liam relihan , kaizhong zhang , girish patel",international conference on management of data,1997,3315
1,wave-indices : indexing evolving databases,"hector garcia-molina , narayanan shivakumar",sigmod conference,1997,wave-indices : indexing evolving databases,"narayanan shivakumar , h &#233; ctor garc &#237; a-molina",international conference on management of data,1997,975
1,are the terms version and variant orthogonal to one another ? a critical assessment of the step standardization,hartmut wedekind,sigmod record,1994,are the terms version and variant orthogonal to one another ?,hartmut wedekind,acm sigmod record,1994,5776
1,xquery formal semantics : state and challenges,peter fankhauser,sigmod record,2001,xquery formal semantics state and challenges,peter fankhauser,acm sigmod record,2001,5215
1,timer-driven database triggers and alerters : semantics and a challenge,"eric n. hanson , lloyd noronha",sigmod record,1999,timer-driven database triggers and alerters : semantics and a challenge,"eric n. hanson , lloyd x. noronha",acm sigmod record,1999,3116
1,formal semantics and analysis of object queries,gavin m. bierman,sigmod conference,2003,formal semantics and analysis of object queries,g. m. bierman,international conference on management of data,2003,4928
1,research issues in databases for arcs : active rapidly changing data systems,anindya datta,sigmod record,1994,research issues in databases for arcs : active rapidly changing data systems,anindya datta,acm sigmod record,1994,1892
1,research issues in active database systems : report from the closing panel at ride-ads '94,jennifer widom,sigmod record,1994,research issues in active database systems : report from the closing panel at ride-ads '94,jennifer widom,acm sigmod record,1994,4552
1,fast algorithms for projected clustering,"joel l. wolf , cecilia magdalena procopiuc , jong soo park , charu c. aggarwal , philip s. yu",sigmod conference,1999,fast algorithms for projected clustering,"charu c. aggarwal , joel l. wolf , philip s. yu , cecilia procopiuc , jong soo park",international conference on management of data,1999,3299
1,a scalable algorithm for answering queries using views,"rachel pottinger , alon y. levy",vldb,2000,a scalable algorithm for answering queries using views,"rachel pottinger , alon y. levy",very large data bases,2000,5057
1,an optimal and progressive algorithm for skyline queries,"bernhard seeger , dimitris papadias , greg fu , yufei tao",sigmod conference,2003,an optimal and progressive algorithm for skyline queries,"dimitris papadias , yufei tao , greg fu , bernhard seeger",international conference on management of data,2003,3520
1,mapinfo spatialware : a spatial information server for rdbms,chebel mina,vldb,1998,mapinfo spatialware : a spatial information server for rdbms,chebel mina,very large data bases,1998,404
1,the software information base : a server for reuse,"panos constantopoulos , yannis vassiliou , matthias jarke , john mylopoulos",vldb j.,1995,the software information base : a server for reuse,"panos constantopoulos , matthias jarke , john mylopoulos , yannis vassiliou",the vldb journal -- the international journal on very large data bases,1995,4899
1,probabilistic object bases,"thomas eiter , v. s. subrahmanian , thomas lukasiewicz , james j. lu",acm trans . database syst .,2001,probabilistic object bases,"thomas eiter , james j. lu , thomas lukasiewicz , v. s. subrahmanian",acm transactions on database systems ( tods ),2001,5172
1,relaxed transaction processing,"darrell woelk , munindar p. singh , christine tomlinson",sigmod conference,1994,relaxed transaction processing,"munindar p. singh , christine tomlinson , darrell woelk",international conference on management of data,1994,5984
1,functional-join processing,"reinhard braumandl , alfons kemper , donald kossmann , jens claußen",vldb j.,2000,functional-join processing,"r. braumandl , j. claussen , a. kemper , d. kossmann",the vldb journal -- the international journal on very large data bases,2000,3216
1,atomicity and isolation for transactional processes,"hans-jörg schek , gustavo alonso , heiko schuldt , catriel beeri",acm trans . database syst .,2002,atomicity and isolation for transactional processes,"heiko schuldt , gustavo alonso , catriel beeri , hans-j &#246; rg schek",acm transactions on database systems ( tods ),2002,6030
1,maintaining database consistency in presence of value dependencies in multidatabase systems,"michèle cart , claire morpain , jean-françois pons , jean ferrié",sigmod conference,1996,maintaining database consistency in presence of value dependencies in multidatabase systems,"claire morpain , mich &#233; le cart , jean ferri &#233; , jean-fran &#231; ois pons",international conference on management of data,1996,2800
1,the gmap : a versatile tool for physical data independence,"marvin h. solomon , yannis e. ioannidis , odysseas g. tsatalos",vldb,1994,the gmap : a versatile tool for physical data independence,"odysseas g. tsatalos , marvin h. solomon , yannis e. ioannidis",very large data bases,1994,7336
1,a componentized architecture for dynamic electronic markets,"israel ben-shaul , benny reich",sigmod record,1998,a componentized architecture for dynamic electronic markets,"benny reich , israel ben-shaul",acm sigmod record,1998,2441
1,a conceptual architecture for semantic web enabled web services,"dieter fensel , alexander maedche , christoph bussler",sigmod record,2002,a conceptual architecture for semantic web enabled web services,"christoph bussler , dieter fensel , alexander maedche",acm sigmod record,2002,3223
1,a layered architecture for querying dynamic web content,"hasan davulcu , michael kifer , i. v. ramakrishnan , juliana freire",sigmod conference,1999,a layered architecture for querying dynamic web content,"hasan davulcu , juliana freire , michael kifer , i. v. ramakrishnan",international conference on management of data,1999,682
1,relational databases for querying xml documents : limitations and opportunities,"jeffrey f. naughton , kristin tufte , chun zhang , gang he , david j. dewitt , jayavel shanmugasundaram",vldb,1999,relational databases for querying xml documents : limitations and opportunities,"jayavel shanmugasundaram , kristin tufte , chun zhang , gang he , david j. dewitt , jeffrey f. naughton",very large data bases,1999,4189
1,efficiently publishing relational data as xml documents,"bruce g. lindsay , hamid pirahesh , berthold reinwald , michael j. carey , rimon barr , jayavel shanmugasundaram , eugene j. shekita",vldb j.,2001,efficiently publishing relational data as xml documents,"jayavel shanmugasundaram , eugene shekita , rimon barr , michael carey , bruce lindsay , hamid pirahesh , berthold reinwald",the vldb journal -- the international journal on very large data bases,2001,3181
1,small materialized aggregates : a light weight index structure for data warehousing,guido moerkotte,vldb,1998,small materialized aggregates : a light weight index structure for data warehousing,guido moerkotte,very large data bases,1998,3044
1,approximate query processing using wavelets,"rajeev rastogi , minos n. garofalakis , kyuseok shim , kaushik chakrabarti",vldb j.,2001,approximate query processing using wavelets,"kaushik chakrabarti , minos garofalakis , rajeev rastogi , kyuseok shim",the vldb journal -- the international journal on very large data bases,2001,5927
1,similarity query processing using disk arrays,"apostolos papadopoulos , yannis manolopoulos",sigmod conference,1998,similarity query processing using disk arrays,"apostolos n. papadopoulos , yannis manolopoulos",international conference on management of data,1998,950
1,semantic integration of semistructured and structured data sources,"sonia bergamaschi , maurizio vincini , silvana castano",sigmod record,1999,semantic integration of semistructured and structured data sources,"s. bergamaschi , s. castano , m. vincini",acm sigmod record,1999,4225
1,the demarcation protocol : a technique for maintaining constraints in distributed database systems,"daniel barbará , hector garcia-molina",vldb j.,1994,the demarcation protocol : a technique for maintaining constraints in distributed database systems,"daniel barbar &#225; - mill &#225; , hector garcia-molina",the vldb journal -- the international journal on very large data bases,1994,3262
1,relating distributed objects,"r. g. g. cattell , bruce e. martin",vldb,1994,relating distributed objects,"bruce e. martin , r. g. g. cattell",very large data bases,1994,6720
1,webview materialization,"nick roussopoulos , alexandros labrinidis",sigmod conference,2000,webview materialization,"alexandros labrinidis , nick roussopoulos",international conference on management of data,2000,1792
1,selectivity estimation in extensible databases - a neural network approach,"shaoyu zhou , m. seetha lakshmi",vldb,1998,selectivity estimation in extensible databases - a neural network approach,"m. seetha lakshmi , shaoyu zhou",very large data bases,1998,609
1,an algebraic approach to static analysis of active database rules,"jennifer widom , elena baralis",acm trans . database syst .,2000,an algebraic approach to static analysis of active database rules,"elena baralis , jennifer widom",acm transactions on database systems ( tods ),2000,4583
1,guest editor 's introduction,asuman dogac,sigmod record,2002,data management issues in electronic commerce : guest editor 's introduction,asuman dogac,acm sigmod record,2002,2907
1,tam : a system for dynamic transactional activity management,"ling liu , calton pu , tong zhou",sigmod conference,1999,tam : a system for dynamic transactional activity management,"tong zhou , ling liu , calton pu",international conference on management of data,1999,5088
1,asset : a system for supporting extended transactions,"narain h. gehani , krithi ramamritham , alexandros biliris , h. v. jagadish , shaul dar",sigmod conference,1994,asset : a system for supporting extended transactions,"a. biliris , s. dar , n. gehani , h. v. jagadish , k. ramamritham",international conference on management of data,1994,4792
1,recovery protocols for shared memory database systems,"lory d. molesky , krithi ramamritham",sigmod conference,1995,recovery protocols for shared memory database systems,"lory d. molesky , krithi ramamritham",international conference on management of data,1995,399
1,multi-dimensional substring selectivity estimation,"divesh srivastava , olga kapitskaia , raymond t. ng , h. v. jagadish",vldb,1999,multi-dimensional substring selectivity estimation,"h. v. jagadish , olga kapitskaia , raymond t. ng , divesh srivastava",very large data bases,1999,5434
1,one-dimensional and multi-dimensional substring selectivity estimation,"raymond t. ng , divesh srivastava , h. v. jagadish , olga kapitskaia",vldb j.,2000,one-dimensional and multi-dimensional substring selectivity estimation,"h. v. jagadish , olga kapitskaia , raymond t. ng , divesh srivastava",the vldb journal -- the international journal on very large data bases,2000,2153
1,approximating multi-dimensional aggregate range queries over real attributes,"carlotta domeniconi , vassilis j. tsotras , george kollios , dimitrios gunopulos",sigmod conference,2000,approximating multi-dimensional aggregate range queries over real attributes,"dimitrios gunopulos , george kollios , vassilis j. tsotras , carlotta domeniconi",international conference on management of data,2000,2384
1,distance-based outliers : algorithms and applications,"v. tucakov , raymond t. ng , edwin m. knorr",vldb j.,2000,distance-based outliers : algorithms and applications,"edwin m. knorr , raymond t. ng , vladimir tucakov",the vldb journal -- the international journal on very large data bases,2000,2399
1,finding intensional knowledge of distance-based outliers,"raymond t. ng , edwin m. knorr",vldb,1999,finding intensional knowledge of distance-based outliers,"edwin m. knorr , raymond t. ng",very large data bases,1999,5862
1,incremental distance join algorithms for spatial databases,"gísli r. hjaltason , hanan samet",sigmod conference,1998,incremental distance join algorithms for spatial databases,"g &#237; sli r. hjaltason , hanan samet",international conference on management of data,1998,5356
