label,ltable_title,ltable_authors,ltable_venue,ltable_year,rtable_title,rtable_authors,rtable_venue,rtable_year,id
1,on the semantics of `` now '' in databases,"christian s. jensen , tomás isakowitz , richard t. snodgrass , curtis e. dyreson , james clifford",acm trans . database syst .,1997,on the semantics of now in databases,"james clifford , curtis dyreson , tom &#225; s isakowitz , christian s. jensen , richard thomas snodgrass",acm transactions on database systems ( tods ),1997,732
1,a top-down approach for two level serializability,"n. l. belkhodja , mourad ouzzani , m. a. atroun",vldb,1994,a top-down approach for two level serializability,"m. ouzzani , m. a. atroun , n. l. belkhodja",very large data bases,1994,5055
1,outlier detection for high dimensional data,"charu c. aggarwal , philip s. yu",sigmod conference,2001,outlier detection for high dimensional data,"charu c. aggarwal , philip s. yu",international conference on management of data,2001,5888
1,automatic subspace clustering of high dimensional data for data mining applications,"johannes gehrke , rakesh agrawal , dimitrios gunopulos , prabhakar raghavan",sigmod conference,1998,automatic subspace clustering of high dimensional data for data mining applications,"rakesh agrawal , johannes gehrke , dimitrios gunopulos , prabhakar raghavan",international conference on management of data,1998,3682
1,improving access to environmental data using context information,"anthony tomasic , eric simon",sigmod record,1997,improving access to environmental data using context information,"anthony tomasic , eric simon",acm sigmod record,1997,5101
1,wavecluster : a wavelet based clustering approach for spatial data in very large databases,"surojit chatterjee , gholamhosein sheikholeslami , aidong zhang",vldb j.,2000,wavecluster : a wavelet-based clustering approach for spatial data in very large databases,"gholamhosein sheikholeslami , surojit chatterjee , aidong zhang",the vldb journal -- the international journal on very large data bases,2000,582
1,clustering categorical data : an approach based on dynamical systems,"david gibson , jon m. kleinberg , prabhakar raghavan",vldb j.,2000,clustering categorical data : an approach based on dynamical systems,"david gibson , jon kleinberg , prabhakar raghavan",the vldb journal -- the international journal on very large data bases,2000,1996
1,searching in metric spaces with user-defined and approximate distances,"marco patella , paolo ciaccia",acm trans . database syst .,2002,searching in metric spaces with user-defined and approximate distances,"paolo ciaccia , marco patella",acm transactions on database systems ( tods ),2002,1046
1,eroc : a toolkit for building neato query optimizers,"melissa truong , louis burger , william j. mckenna , chi hoang",vldb,1996,eroc : a toolkit for building neato query optimizers,"william j. mckenna , louis burger , chi hoang , melissa truong",very large data bases,1996,6419
1,topological relations in the world of minimum bounding rectangles : a study with r-trees,"dimitris papadias , timos k. sellis , yannis theodoridis , max j. egenhofer",sigmod conference,1995,topological relations in the world of minimum bounding rectangles : a study with r-trees,"dimitris papadias , timos sellis , yannis theodoridis , max j. egenhofer",international conference on management of data,1995,2973
1,similarity-based queries for time series data,"alberto o. mendelzon , davood rafiei",sigmod conference,1997,similarity-based queries for time series data,"davood rafiei , alberto mendelzon",international conference on management of data,1997,6978
1,time series similarity measures and time series indexing,"gautam das , dimitrios gunopulos",sigmod conference,2001,time series similarity measures and time series indexing ( abstract only ),"dimitrios gunopulos , gautam das",international conference on management of data,2001,513
1,"o-o , what 's happening to db2 ?","richard swagerman , nelson mendonça mattos , michael j. carey , srinivasa narayanan , bennet vance , doug doole , serge rielau , donald d. chamberlin",sigmod conference,1999,"o-o , what 's happening to db2 ?","m. carey , d. chamberlin , d. doole , s. rielau , n. mattos , s. narayanan , b. vance , r. swagerman",international conference on management of data,1999,1703
1,hardware acceleration for spatial selections and joins,"chengyu sun , divyakant agrawal , amr el abbadi",sigmod conference,2003,hardware acceleration for spatial selections and joins,"chengyu sun , divyakant agrawal , amr el abbadi",international conference on management of data,2003,1078
1,evolvable view environment ( eve ) : non-equivalent view maintenance under schema changes,"andreas koeller , amy j. lee , xin zhang , anisoara nica , elke a. rundensteiner , amber van wyk , yong li",sigmod conference,1999,evolvable view environment ( eve ) : non-equivalent view maintenance under schema changes,"e. a. rundensteiner , a. koeller , x. zhang , a. j. lee , a. nica , a. van wyk , y. lee",international conference on management of data,1999,6061
1,exploiting versions for handling updates in broadcast disks,"evaggelia pitoura , panos k. chrysanthis",vldb,1999,exploiting versions for handling updates in broadcast disks,"evaggelia pitoura , panos k. chrysanthis",very large data bases,1999,3109
1,ordered shared locks for real-time databases,"richard jeffers , divyakant agrawal , amr el abbadi , lijing lin",vldb j.,1995,ordered shared locks for real-time databases,"divyakant agrawal , amr el abbadi , richard jeffers , lijing lin",the vldb journal -- the international journal on very large data bases,1995,5592
1,an approximate search engine for structural databases,"kaizhong zhang , qicheng ma , jason tsong-li wang , xinhuan zheng , xiong wang , dennis shasha , zasha weinberg , bruce a. shapiro",sigmod conference,2000,an approximate search engine for structural databases,"jason t. l. wang , xiong wang , dennis shasha , bruce a. shapiro , kaizhong zhang , qicheng ma , zasha weinberg",international conference on management of data,2000,1206
1,on index selection schemes for nested object hierarchies,"sudarshan s. chawathe , ming-syan chen , philip s. yu",vldb,1994,on index selection schemes for nested object hierarchies,"sudarshan s. chawathe , ming-syan chen , philip s. yu",very large data bases,1994,3367
1,videoanywhere : a system for searching and managing distributed video assets,"amit p. sheth , kshitij shah , clemens bertram",sigmod record,1999,video anywhere : a system for searching and managing distributed heterogeneous video assets,"amit sheth , clemens bertram , kshitij shah",acm sigmod record,1999,3020
1,the xxl search engine : ranked retrieval of xml data using indexes and ontologies,"anja theobald , gerhard weikum",sigmod conference,2002,the xxl search engine : ranked retrieval of xml data using indexes and ontologies,"anja theobald , gerhard weikum",international conference on management of data,2002,3664
1,indexing medium-dimensionality data in oracle,"jayant sharma , kothuri venkata ravi kanth , jay banerjee , siva ravada",sigmod conference,1999,indexing medium-dimensionality data in oracle,"k. v. ravi kanth , siva ravada , jayant sharma , jay banerjee",international conference on management of data,1999,4917
1,towards event-driven modelling for database design,"maguelonne teisseire , pascal poncelet , rosine cicchetti",vldb,1994,towards event-driven modelling for database design,"maguelonne teisseire , pascal poncelet , rosine cicchetti",very large data bases,1994,3191
1,report on the second ieee metadata conference ( metadata ' 97 ),"chris miller , ron musick",sigmod record,1998,report on the second ieee metadata conference ( metadata ' 97 ),"ron musick , chris miller",acm sigmod record,1998,451
1,the dedale system for complex spatial queries,"luc segoufin , philippe rigaux , stéphane grumbach",sigmod conference,1998,the dedale system for complex spatial queries,"st &#233; phane grumbach , philippe rigaux , luc segoufin",international conference on management of data,1998,7374
1,efficient mid-query re-optimization of sub-optimal query execution plans,"david j. dewitt , navin kabra",sigmod conference,1998,efficient mid-query re-optimization of sub-optimal query execution plans,"navin kabra , david j. dewitt",international conference on management of data,1998,3269
1,the heterogeneity problem and middleware technology : experiences with and performance of database gateways,"klaudia hergula , fernando de ferreira rezende",vldb,1998,the heterogeneity problem and middleware technology : experiences with and performance of database gateways,"fernando de ferreira rezende , klaudia hergula",very large data bases,1998,1232
1,journal relevance,richard t. snodgrass,sigmod record,2003,journal relevance,richard snodgrass,acm sigmod record,2003,6946
1,generating efficient plans for queries using views,"chen li , jeffrey d. ullman , foto n. afrati",sigmod conference,2001,generating efficient plans for queries using views,"foto n. afrati , chen li , jeffrey d. ullman",international conference on management of data,2001,7067
1,a super scalar sort algorithm for risc processors,ramesh c. agarwal,sigmod conference,1996,a super scalar sort algorithm for risc processors,ramesh c. agarwal,international conference on management of data,1996,5066
1,orthogonal optimization of subqueries and aggregation,"milind joshi , césar a. galindo-legaria",sigmod conference,2001,orthogonal optimization of subqueries and aggregation,"c &#233; sar galindo-legaria , milind joshi",international conference on management of data,2001,242
1,the nimble integration engine,"daniel s. weld , alon y. halevy , denise draper",sigmod conference,2001,the nimble integration engine,"denise draper , alon y. halevy , daniel s. weld",international conference on management of data,2001,574
1,use of a component architecture in integrating relational and non-relational storage systems,robert g. atkinson,sigmod conference,1995,use of a component architecture in integrating relational and non-relational,robert atkinson,international conference on management of data,1995,2275
1,comparative analysis of five xml query languages,"angela bonifati , stefano ceri",sigmod record,2000,comparative analysis of five xml query languages,"angela bonifati , stefano ceri",acm sigmod record,2000,2101
1,on completeness of historical relational query languages,"james clifford , albert croker , alexander tuzhilin",acm trans . database syst .,1994,on completeness of historical relational query languages,"james clifford , albert croker , alexander tuzhilin",acm transactions on database systems ( tods ),1994,6460
1,evolving teradata decision support for massively parallel processing with unix,carrie ballinger,sigmod conference,1994,evolving teradata decision support for massively parallel processing with unix,carrie ballinger,international conference on management of data,1994,6811
1,an extensible compressor for xml data,"dan suciu , hartmut liefke",sigmod record,2000,an extensible compressor for xml data,"hartmut liefke , dan suciu",acm sigmod record,2000,5883
1,using the golden rule of sampling for query estimation,"amr el abbadi , yi-leh wu , divyakant agrawal",sigmod conference,2001,applying the golden rule of sampling for query estimation,"yi-leh wu , divyakant agrawal , amr el abbadi",international conference on management of data,2001,7227
1,spatial queries in dynamic environments,"yufei tao , dimitris papadias",acm trans . database syst .,2003,spatial queries in dynamic environments,"yufei tao , dimitris papadias",acm transactions on database systems ( tods ),2003,5182
1,ibm 's db2 universal database demonstrations at vldb '98,"k. bernhard schiefer , karen brannon , guy m. lohman , gene fuh , jim kleewein",vldb,1998,ibm 's db2 universal database demonstrations at vldb '98,"k. bernhard schiefer , jim kleewein , karen brannon , guy m. lohman , gene fuh",very large data bases,1998,963
1,active views for electronic commerce,"laurent mignet , serge abiteboul , tova milo , adi eyal , bernd amann , sophie cluet",vldb,1999,active views for electronic commerce,"serge abiteboul , bernd amann , sophie cluet , adi eyal , laurent mignet , tova milo",very large data bases,1999,1216
1,active storage for large-scale data mining and multimedia,"garth a. gibson , erik riedel , christos faloutsos",vldb,1998,active storage for large-scale data mining and multimedia,"erik riedel , garth a. gibson , christos faloutsos",very large data bases,1998,3542
1,hyperqueries : dynamic distributed query processing on the internet,"alfons kemper , christian wiesner",vldb,2001,hyperqueries : dynamic distributed query processing on the internet,"alfons kemper , christian wiesner",very large data bases,2001,1127
1,predictive dynamic load balancing of parallel and distributed rule and query processing,"jae-jun hwang , mauricio a. hernández , salvatore j. stolfo , hasanat m. dewan",sigmod conference,1994,predictive dynamic load balancing of parallel and distributed rule and query processing,"hasanat m. dewan , salvatore j. stolfo , mauricio hern &#225; ndez , jae-jun hwang",international conference on management of data,1994,6108
1,efficient and tunable similar set retrieval,"dimitrios gunopulos , aristides gionis , nick koudas",sigmod conference,2001,efficient and tumble similar set retrieval,"aristides gionis , dimitrios gunopulos , nick koudas",international conference on management of data,2001,4120
1,efficient retrieval of similar shapes,"davood rafiei , alberto o. mendelzon",vldb j.,2002,efficient retrieval of similar shapes,"davood rafiei , alberto o. mendelzon",the vldb journal -- the international journal on very large data bases,2002,7371
1,logical and physical versioning in main memory databases,"s. seshadri , rajeev rastogi , abraham silberschatz , philip bohannon , dennis w. leinbaugh , s. sudarshan",vldb,1997,logical and physical versioning in main memory databases,"rajeev rastogi , s. seshadri , philip bohannon , dennis w. leinbaugh , abraham silberschatz , s. sudarshan",very large data bases,1997,3187
1,intelligent rollups in multidimensional olap data,"sunita sarawagi , gayatri sathe",vldb,2001,intelligent rollups in multidimensional olap data,"gayatri sathe , sunita sarawagi",very large data bases,2001,6752
1,management of multidimensional discrete data,peter baumann,vldb j.,1994,management of multidimensional discrete data,peter baumann,the vldb journal -- the international journal on very large data bases,1994,1055
1,"panel : future directions of database research - the vldb broadening strategy , part 2",michael l. brodie,vldb,2000,"panel : future directions of database research - the vldb broadening strategy , part 2",michael l. brodie,very large data bases,2000,5806
1,copy detection mechanisms for digital documents,"hector garcia-molina , sergey brin , james davis",sigmod conference,1995,copy detection mechanisms for digital documents,"sergey brin , james davis , h &#233; ctor garc &#237; a-molina",international conference on management of data,1995,2947
1,"adaptable pointer swizzling strategies in object bases : design , realization , and quantitative analysis","alfons kemper , donald kossmann",vldb j.,1995,"adaptable pointer swizzling strategies in object bases : design , realization , and quantitative analysis","alfons kemper , donald kossmann",the vldb journal -- the international journal on very large data bases,1995,2830
1,research perspectives for time series management systems,"duri schmidt , angelika kotz dittrich , werner dreyer",sigmod record,1994,research perspectives for time series management systems,"werner dreyer , angelika kotz dittrich , duri schmidt",acm sigmod record,1994,4655
1,orthogonally persistent object systems,"malcolm p. atkinson , ronald morrison",vldb j.,1995,orthogonally persistent object systems,"malcolm atkinson , ronald morrison",the vldb journal -- the international journal on very large data bases,1995,5667
1,general match : a subsequence matching method in time-series databases based on generalized windows,"kyu-young whang , yang-sae moon , wook-shin han",sigmod conference,2002,general match : a subsequence matching method in time-series databases based on generalized windows,"yang-sae moon , kyu-young whang , wook-shin han",international conference on management of data,2002,3805
1,to table or not to table : a hypertabular answer,"giuseppe santucci , laura tarantino",sigmod record,1996,to table or not to table : a hypertabular answer,"giuseppe santucci , laura tarantino",acm sigmod record,1996,6607
1,using extended feature objects for partial similarity retrieval,"hans-peter kriegel , stefan berchtold , daniel a. keim",vldb j.,1997,using extended feature objects for partial similarity retrieval,"stefan berchtold , daniel a. keim , hans-peter kriegel",the vldb journal -- the international journal on very large data bases,1997,3496
1,falcon : feedback adaptive loop for content-based retrieval,"christos faloutsos , leejay wu , katia p. sycara , terry r. payne",vldb,2000,falcon : feedback adaptive loop for content-based retrieval,"leejay wu , christos faloutsos , katia p. sycara , terry r. payne",very large data bases,2000,2172
1,qcluster : relevance feedback using adaptive clustering for content-based image retrieval,"deok-hwan kim , chin-wan chung",sigmod conference,2003,qcluster : relevance feedback using adaptive clustering for content-based image retrieval,"deok-hwan kim , chin-wan chung",international conference on management of data,2003,2397
1,near neighbor search in large metric spaces,sergey brin,vldb,1995,near neighbor search in large metric spaces,sergey brin,very large data bases,1995,1144
1,index-driven similarity search in metric spaces,"gísli r. hjaltason , hanan samet",acm trans . database syst .,2003,index-driven similarity search in metric spaces,"gisli r. hjaltason , hanan samet",acm transactions on database systems ( tods ),2003,2719
1,online feedback for nested aggregate queries with multi-threading,"beng chin ooi , kian-lee tan , cheng hian goh",vldb,1999,online feedback for nested aggregate queries with multi-threading,"kian-lee tan , cheng hian goh , beng chin ooi",very large data bases,1999,6708
1,improving index performance through prefetching,"shimin chen , todd c. mowry , phillip b. gibbons",sigmod conference,2001,improving index performance through prefetching,"shimin chen , phillip b. gibbons , todd c. mowry",international conference on management of data,2001,4839
1,a toolkit for negotiation support interfaces to multi-dimensional data,"matthias jarke , stephan jacobs , michael gebhardt",sigmod conference,1997,a toolkit for negotiation support interfaces to multi-dimensional data,"michael gebhardt , matthias jarke , stephan jacobs",international conference on management of data,1997,6482
1,declustering of key-based partitioned signature files,"pavel zezula , paolo ciaccia , paolo tiberio",acm trans . database syst .,1996,declustering of key-based partitioned signature files,"paolo ciaccia , paolo tiberio , pavel zezula",acm transactions on database systems ( tods ),1996,1567
1,dynamic resource brokering for multi-user query execution,"diane l. davison , goetz graefe",sigmod conference,1995,dynamic resource brokering for multi-user query execution,"diane l. davison , goetz graefe",international conference on management of data,1995,1116
1,dynamic content acceleration : a caching solution to enable scalable dynamic web page generation,"debra e. vandermeer , krithi ramamritham , helen m. thomas , anindya datta , kaushik dutta",sigmod conference,2001,dynamic content acceleration : a caching solution to enable scalable dynamic web page generation,"anindya datta , kaushik dutta , krithi ramamritham , helen thomas , debra vandermeer",international conference on management of data,2001,459
1,towards an odmg-compliant visual object query language,"manoj chavda , peter t. wood",vldb,1997,towards an odmg-compliant visual object query language,"manoj chavda , peter t. wood",very large data bases,1997,1667
1,what will be - book review,paul w. p. j. grefen,sigmod record,2002,what will be,michael dertouzos,acm sigmod record,2002,6087
1,model and verification of a data manager based on aries,dean kuo,acm trans . database syst .,1996,model and verification of a data manager based on aries,dean kuo,acm transactions on database systems ( tods ),1996,445
1,performance measurements of tertiary storage devices,"ethan l. miller , theodore johnson",vldb,1998,performance measurements of tertiary storage devices,"theodore johnson , ethan l. miller",very large data bases,1998,2733
1,tutorial : ldap directory services - just another database application ?,"anand deshpande , shridhar shukla",sigmod conference,2000,ldap directory services - just another database application ? ( tutorial session ),"shridhar shukla , anand deshpande",international conference on management of data,2000,4215
1,metadata standards for data warehousing : open information model vs. common warehouse metamodel,"anca vaduva , thomas vetterli , martin staudt",sigmod record,2000,metadata standards for data warehousing : open information model vs. common warehouse metadata,"thomas vetterli , anca vaduva , martin staudt",acm sigmod record,2000,2102
1,winmagic : subquery elimination using window aggregation,"qi cheng , hamid pirahesh , linqi liu , kwai wong , wenbin ma , calisto zuzarte",sigmod conference,2003,winmagic : subquery elimination using window aggregation,"calisto zuzarte , hamid pirahesh , wenbin ma , qi cheng , linqi liu , kwai wong",international conference on management of data,2003,6132
1,bess : storage support for interactive visualization systems,"william o'connell , thomas a. funkhouser , alexandros biliris , euthimios panagos",sigmod conference,1996,bess : storage support for interactive visualization systems,"a. biliris , t. a. funkhouser , w. o'connell , e. panagos",international conference on management of data,1996,6099
1,efficient support for interactive service in multi-resolution vod systems,"leana golubchik , kelvin kwok-wai law , john c. s. lui",vldb j.,1999,efficient support for interactive service in multi-resolution vod systems,"kelvin k. w. law , john c. s. lui , leana golubchik",the vldb journal -- the international journal on very large data bases,1999,6649
1,an annotated bibliography on active databases,"johann christoph freytag , ulrike jaeger",sigmod record,1995,an annotated bibliography on active databases ( short version ),"ulrike jaeger , johann christoph freytag",acm sigmod record,1995,7222
1,treasurer 's message,joachim hammer,sigmod record,2002,treasurer 's message,joachim hammer,acm sigmod record,2002,3845
1,contorting high dimensional data for efficient main memory processing,"beng chin ooi , bin cui , kian-lee tan , jianwen su",sigmod conference,2003,contorting high dimensional data for efficient main memory knn processing,"bin cui , beng chin ooi , jianwen su , kian-lee tan",international conference on management of data,2003,3294
1,statix : making xml count,"jayant r. haritsa , juliana freire , maya ramanath , prasan roy , jérôme siméon",sigmod conference,2002,statix : making xml count,"juliana freire , jayant r. haritsa , maya ramanath , prasan roy , j &#233; r &#244; me sim &#233; on",international conference on management of data,2002,2466
1,"the clustra telecom database : high availability , high throughput , and real-time response","svein-olaf hvasshovd , øystein torbjørnsen , svein erik bratsberg , per holager",vldb,1995,"the clustra telecom database : high availability , high throughput , and real-time response","svein-olaf hvasshovd , &#216; ystein torbj &#248; rnsen , svein erik bratsberg , per holager",very large data bases,1995,6157
1,semantic interoperability in information services : experiencing with coopware,avigdor gal,sigmod record,1999,semantic interoperability in information services : experiencing with coopware,avigdor gal,acm sigmod record,1999,4068
1,query by diagram : a graphical environment for querying databases,"giuseppe santucci , tiziana catarci",sigmod conference,1994,query by diagram : a graphical environment for querying databases,"tiziana catarci , giuseppe santucci",international conference on management of data,1994,6810
1,complex relationships and knowledge discovery support in the infoquilt system,"amit p. sheth , sanjeev thacker , shuchi patel",vldb j.,2003,complex relationships and knowledge discovery support in the infoquilt system,"a. sheth , s. thacker , s. patel",the vldb journal -- the international journal on very large data bases,2003,1357
1,exploiting early sorting and early partitioning for decisionsupport query processing,"jens claußen , christian wiesner , donald kossmann , alfons kemper",vldb j.,2000,exploiting early sorting and early partitioning for decision support query processing,"j. claussen , a. kemper , d. kossmann , c. wiesner",the vldb journal -- the international journal on very large data bases,2000,3717
1,tutorial : data access,"anand deshpande , josé a. blakeley",sigmod conference,2000,data access ( tutorial session ),"jos &#233; a. blakeley , anand deshpande",international conference on management of data,2000,58
1,fast joins using join indices,"kenneth a. ross , zhe li",vldb j.,1999,fast joins using join indices,"zhe li , kenneth a. ross",the vldb journal -- the international journal on very large data bases,1999,4622
1,multi-table joins through bitmapped join indices,"goetz graefe , patrick e. o'neil",sigmod record,1995,multi-table joins through bitmapped join indices,"patrick o'neil , goetz graefe",acm sigmod record,1995,851
