label,ltable_title,ltable_authors,ltable_venue,ltable_year,rtable_title,rtable_authors,rtable_venue,rtable_year,id
1,expressing business rules,ronald g. ross,sigmod conference,2000,expressing business rules,ronald g. ross,international conference on management of data,2000,6625
1,xml-based information mediation with mix,"yannis papakonstantinou , richard marciano , chaitanya k. baru , pavel velikhov , vincent chu , amarnath gupta , bertram ludäscher",sigmod conference,1999,xml-based information mediation with mix,"chaitan baru , amarnath gupta , bertram lud &#228; scher , richard marciano , yannis papakonstantinou , pavel velikhov , vincent chu",international conference on management of data,1999,3817
1,on xml and databases : where 's the beef ? ( panel abstract ),michael j. carey,sigmod conference,2000,of xml and databases ( panel session ) : where 's the beef ?,"jennifer widom , adam bosworth , bruce lindsay , michael stonebraker , dan suciu",international conference on management of data,2000,4026
1,nonstop sql : scalability and availability for decision support,susanne englert,sigmod conference,1994,nonstop sql : scalability and availability for decision support,susanne englert,international conference on management of data,1994,4940
1,scalablity and availability in oracle7 7.3,dieter gawlick,vldb,1996,scalablity and availability in oracle7 7.3,dieter gawlick,very large data bases,1996,5150
1,manipulating interpolated data is easier than you thought,"stéphane grumbach , philippe rigaux , luc segoufin",vldb,2000,manipulating interpolated data is easier than you thought,"st &#233; phane grumbach , philippe rigaux , luc segoufin",very large data bases,2000,4851
1,high-concurrency locking in r-trees,"douglas banks , marcel kornacker",vldb,1995,high-concurrency locking in r-trees,"marcel kornacker , douglas banks",very large data bases,1995,7205
1,a framework for information visualisation,"peter j. barclay , kenneth j. mitchell , jessie b. kennedy",sigmod record,1996,a framework for information visualisation,"jessie b. kennedy , kenneth j. mitchell , peter j. barclay",acm sigmod record,1996,4078
1,iterative spatial join,"hanan samet , edwin h. jacox",acm trans . database syst .,2003,iterative spatial join,"edwin h. jacox , hanan samet",acm transactions on database systems ( tods ),2003,2216
1,on spatially partitioned temporal join,"beng chin ooi , kian-lee tan , hongjun lu",vldb,1994,on spatially partitioned temporal join,"hongjun lu , beng chin ooi , kian-lee tan",very large data bases,1994,1409
1,using schema matching to simplify heterogeneous data translation,"tova milo , sagit zohar",vldb,1998,using schema matching to simplify heterogeneous data translation,"tova milo , sagit zohar",very large data bases,1998,4966
1,using schematically heterogeneous structures,renée j. miller,sigmod conference,1998,using schematically heterogeneous structures,re &#233; e j. miller,international conference on management of data,1998,0
1,unix rdbms : the next generation,bill rosneblatt,sigmod record,1994,unix rdbms : the next generation what are the unix relational-database vendors doing to survive in the next generation of client/server environments,bill rosenblatt,acm sigmod record,1994,1032
1,component-based e-commerce : assesment of current practices and future directions,"martin bichler , arie segev , j. leon zhao",sigmod record,1998,component-based e-commerce : assessment of current practices and future directions,"martin bichler , arie segev , j. leon zhao",acm sigmod record,1998,3063
1,approximate similarity retrieval with m-trees,"fausto rabitti , giuseppe amato , pavel zezula , pasquale savino",vldb j.,1998,approximate similarity retrieval with m-trees,"pavel zezula , pasquale savino , giuseppe amato , fausto rabitti",the vldb journal -- the international journal on very large data bases,1998,5533
1,an extendible hash for multi-precision similarity querying of image databases,"m. tamer özsu , shu lin , raymond t. ng , vincent oria",vldb,2001,an extendible hash for multi-precision similarity querying of image databases,"shu lin , m. tamer &#214; zsu , vincent oria , raymond t. ng",very large data bases,2001,7064
1,a consensus glossary of temporal database concepts,"shashi k. gadia , christian s. jensen , patrick j. hayes , ramez elmasri , sushil jajodia , james clifford",sigmod record,1994,a consensus glossary of temporal database concepts,"curtis dyreson , fabio grandi , wolfgang k &#228; fer , nick kline , nikos lorentzos , yannis mitsopoulos , angelo montanari , daniel nonen , elisa peressi , barbara pernici , john f. roddick , nandlal l. sarda , maria rita scalas , arie segev , richard thomas snodgrass , mike d. soo , abdullah tansel , paolo tiberio , gio wiederhold",acm sigmod record,1994,2014
1,data modeling of time-based media,"simon j. gibbs , christian breiteneder , dennis tsichritzis",sigmod conference,1994,data modeling of time-based media,"simon gibbs , christian breiteneder , dennis tsichritzis",international conference on management of data,1994,1513
1,scalable techniques for mining causal structures,"sergey brin , craig silverstein , rajeev motwani , jeffrey d. ullman",vldb,1998,scalable techniques for mining causal structures,"craig silverstein , sergey brin , rajeev motwani , jeffrey d. ullman",very large data bases,1998,142
1,unbundling active functionality,"hans fritschi , arne koschel , günter von bültzingsloewen , stella gatziu",sigmod record,1998,unbundling active functionality,"stella gatziu , arne koschel , g &#252; nter von b &#252; ltzingsloewen , hans fritschi",acm sigmod record,1998,572
1,data streams : fresh current or stagnant backwater ? ( panel ),"joseph m. hellerstein , jennifer widom",sigmod conference,2002,data streams : fresh current or stagnant backwater ? ( panel ),"joseph m. hellerstein , jennifer widom",international conference on management of data,2002,6856
1,incomplete path expressions and their disambiguation,"yannis e. ioannidis , yezdi lashkari",sigmod conference,1994,incomplete path expressions and their disambiguation,"yannis e. ioannidis , yezdi lashkari",international conference on management of data,1994,3118
1,real world requirements for decision support - implications for rdbms,sanju k. bansal,sigmod conference,1995,real world requirements for decision support-implications for rdbms,sanju k. bansal,international conference on management of data,1995,6019
1,inverted files versus signature files for text indexing,"kotagiri ramamohanarao , justin zobel , alistair moffat",acm trans . database syst .,1998,inverted files versus signature files for text indexing,"justin zobel , alistair moffat , kotagiri ramamohanarao",acm transactions on database systems ( tods ),1998,1668
1,olap + + : powerful and easy-to-use federations of olap and object databases,"junmin gu , arie shoshani , torben bach pedersen",vldb,2000,olap + + : powerful and easy-to-use federations of olap and object databases,"junmin gu , torben bach pedersen , arie shoshani",very large data bases,2000,830
1,bitmap index design and evaluation,"yannis e. ioannidis , chee yong chan",sigmod conference,1998,bitmap index design and evaluation,"chee-yong chan , yannis e. ioannidis",international conference on management of data,1998,3947
1,privacy-preserving data mining,"ramakrishnan srikant , rakesh agrawal",sigmod conference,2000,privacy-preserving data mining,"rakesh agrawal , ramakrishnan srikant",international conference on management of data,2000,701
1,storage service providers : a solution for storage management ? ( panel ),"elizabeth a. m. shriver , bruce hillyer , wee teck ng , banu özden , eran gabber , david j. dewitt , john wilkes , jim gray , bruce gordon",vldb,2001,storage service providers : a solution for storage management ? ( panel ),"banu &#214; zden , eran gabber , bruce hillyer , wee teck ng , elizabeth a. m. shriver , david j. dewitt , bruce gordon , jim gray , john wilkes",very large data bases,2001,2775
1,extracting large data sets using db2 parallel edition,sriram padmanabhan,vldb,1996,extracting large data sets using db2 parallel edition,sriram padmanabhan,very large data bases,1996,5864
1,an alternative storage organization for rolap aggregate views based on cubetrees,"yannis kotidis , nick roussopoulos",sigmod conference,1998,an alternative storage organization for rolap aggregate views based on cubetrees,"yannis kotidis , nick roussopoulos",international conference on management of data,1998,7360
1,the active multisync controller of the cubetree storage organization,"yannis sismanis , yannis kotidis , nick roussopoulos",sigmod conference,1999,the active multisync controller of the cubetree storage organization,"nick roussopoulos , yannis kotidis , yannis sismanis",international conference on management of data,1999,1414
1,red brick warehouse : a read-mostly rdbms for open smp platforms,phillip m. fernandez,sigmod conference,1994,red brick warehouse : a read-mostly rdbms for open smp platforms,phillip m. fernandez,international conference on management of data,1994,5894
1,integrating replacement policies in storm : an extensible approach,"stéphane bressan , kian-lee tan , beng chin ooi , chong leng goh",sigmod conference,2000,integrating replacement policies in storm : an extensible approach,"chong leng goh , beng chin ooi , stephane bressan , kian-lee tan",international conference on management of data,2000,4426
1,a study on data point search for hg-trees,"paul h. lewis , joseph kuan",sigmod record,1999,a study on data point search for hg-trees,"joseph kuan , paul lewis",acm sigmod record,1999,4258
1,2q : a low overhead high performance buffer management replacement algorithm,"dennis shasha , theodore johnson",vldb,1994,2q : a low overhead high performance buffer management replacement algorithm,"theodore johnson , dennis shasha",very large data bases,1994,5840
1,skew handling techniques in sort-merge join,"richard t. snodgrass , wei li , dengfeng gao",sigmod conference,2002,skew handling techniques in sort-merge join,"wei li , dengfeng gao , richard thomas snodgrass",international conference on management of data,2002,6426
1,online dynamic reordering,"bhaskaran raman , joseph m. hellerstein , vijayshankar raman",vldb j.,2000,online dynamic reordering,"vijayshankar raman , bhaskaran raman , joseph m. hellerstein",the vldb journal -- the international journal on very large data bases,2000,7100
1,online dynamic reordering for interactive data processing,"bhaskaran raman , joseph m. hellerstein , vijayshankar raman",vldb,1999,online dynamic reordering for interactive data processing,"vijayshankar raman , bhaskaran raman , joseph m. hellerstein",very large data bases,1999,6296
1,handling very large databases with informix extended parallel server,andreas weininger,sigmod conference,2000,handling very large databases with informix extended parallel server,andreas weininger,international conference on management of data,2000,1295
1,ajax : an extensible data cleaning tool,"daniela florescu , helena galhardas , dennis shasha , eric simon",sigmod conference,2000,ajax : an extensible data cleaning tool,"helena galhardas , daniela florescu , dennis shasha , eric simon",international conference on management of data,2000,634
1,eos : an extensible object store,"euthimios panagos , alexandros biliris",sigmod conference,1994,eos : an extensible object store,"alexandros biliris , euthimios panagos",international conference on management of data,1994,1663
1,mid-tier caching : the timesten approach,times-ten team,sigmod conference,2002,mid-tier caching : the timesten approach,the timesten team,international conference on management of data,2002,145
1,"improving business process quality through exception understanding , prediction , and prevention","fabio casati , daniela grigori , umeshwar dayal , ming-chien shan",vldb,2001,"improving business process quality through exception understanding , prediction , and prevention","daniela grigori , fabio casati , umeshwar dayal , ming-chien shan",very large data bases,2001,4522
1,eager aggregation and lazy aggregation,"weipeng p. yan , per-åke larson",vldb,1995,eager aggregation and lazy aggregation,"weipeng p. yan , per - &#197; ke larson",very large data bases,1995,2124
1,software as a service : asp and asp aggregation,christoph bussler,sigmod conference,2002,software as a service : asp and asp aggregation,christoph bussler,international conference on management of data,2002,5887
1,predator : a resource for database research,praveen seshadri,sigmod record,1998,predator : a resource for database research,praveen seshadri,acm sigmod record,1998,7033
1,data manager for evolvable real-time command and control systems,"eric hughes , roman ginis , bhavani m. thuraisingham , peter c. krupp , john a. maurer",vldb,1997,data manager for evolvable real-time command and control systems,"eric hughes , roman ginis , bhavani m. thuraisingham , peter c. krupp , john a. maurer",very large data bases,1997,2277
1,visual coko : a debugger for query optimizer development,"daniel j. abadi , mitch cherniack",sigmod conference,2002,visual coko : a debugger for query optimizer development,"daniel j. abadi , mitch cherniack",international conference on management of data,2002,2803
1,shrinking the warehouse update window,"hector garcia-molina , ramana yerneni , wilburt labio",sigmod conference,1999,shrinking the warehouse update window,"wilburt juan labio , ramana yerneni , hector garcia-molina",international conference on management of data,1999,2582
1,temporal fds on complex objects,jef wijsen,acm trans . database syst .,1999,temporal fds on complex objects,jef wijsen,acm transactions on database systems ( tods ),1999,6362
1,toward autonomic computing with db2 universal database,"guy m. lohman , daniel c. zilio , sam lightstone",sigmod record,2002,toward autonomic computing with db2 universal database,"sam s. lightstone , guy lohman , danny zilio",acm sigmod record,2002,4737
1,"self-adaptive , on-line reclustering of complex object data","william j. mciver jr. , roger king",sigmod conference,1994,"self-adaptive , on-line reclustering of complex object data","william j. mciver , jr. , roger king",international conference on management of data,1994,4887
1,lifestreams : a storage model for personal data,"eric freeman , david gelernter",sigmod record,1996,lifestreams : a storage model for personal data,"eric freeman , david gelernter",acm sigmod record,1996,891
1,new partnership with acm and update on the journal,m. tamer özsu,vldb j.,2003,new partnership with acm and update on the journal,m. tamer &#214; zsu,the vldb journal -- the international journal on very large data bases,2003,5365
1,informix online xps,robert h. gerber,sigmod conference,1995,informix online xps,bob gerber,international conference on management of data,1995,1815
1,are quorums an alternative for data replication ?,"bettina kemme , ricardo jiménez-peris , marta patiño-martínez , gustavo alonso",acm trans . database syst .,2003,are quorums an alternative for data replication ?,"ricardo jim &#233; nez-peris , m. pati &#241; o-mart &#237; nez , gustavo alonso , bettina kemme",acm transactions on database systems ( tods ),2003,6936
1,data replication for mobile computers,"a. prasad sistla , ouri wolfson , yixiu huang",sigmod conference,1994,data replication for mobile computers,"yixiu huang , prasad sistla , ouri wolfson",international conference on management of data,1994,565
1,a research status report on adaptation for mobile data access,"brian noble , mahadev satyanarayanan",sigmod record,1995,a research status report on adaptation for mobile data access,"brian d. noble , m. satyanarayanan",acm sigmod record,1995,1377
1,a sequential pattern query language for supporting instant data mining for e-services,"reza sadri , amir m. zarkesh , jafar adibi , carlo zaniolo",vldb,2001,a sequential pattern query language for supporting instant data mining for e-services,"reza sadri , carlo zaniolo , amir m. zarkesh , jafar adibi",very large data bases,2001,2093
1,dynamic buffer allocation in video-on-demand systems,"kyu-young whang , yang-sae moon , il-yeol song , sang ho lee",sigmod conference,2001,dynamic buffer allocation in video-on-demand systems,"sang-ho lee , kyu-young whang , yang-sae moon , il-yeol song",international conference on management of data,2001,2808
1,"the hb-pi-tree : a multi-attribute index supporting concurrency , recovery and node consolidation","betty salzberg , david b. lomet , georgios evangelidis",vldb j.,1997,"the hb $ ^ \ \ pi $ - tree : a multi-attribute index supporting concurrency , recovery and node consolidation","georgios evangelidis , david lomet , betty salzberg",the vldb journal -- the international journal on very large data bases,1997,1463
1,"the hbp-tree : a modified hb-tree supporting concurrency , recovery and node consolidation","georgios evangelidis , betty salzberg , david b. lomet",vldb,1995,"the hbp-tree : a modified hb-tree supporting concurrency , recovery and node consolidation","georgios evangelidis , david b. lomet , betty salzberg",very large data bases,1995,780
1,koda - the architecture and interface of a data model independent kernel,"gopalan arun , ashok joshi",vldb,1998,koda - the architecture and interface of a data model independent kernel,"gopalan arun , ashok joshi",very large data bases,1998,7341
1,tsql2 language specification,"wolfgang käfer , curtis e. dyreson , arie segev , krishna g. kulkarni , michael d. soo , don s. batory , ramez elmasri , nikos a. lorentzos , nick kline , john f. roddick , gad ariav , james clifford , richard t. snodgrass , suryanarayana m. sripada , t. y. cliff leung , fabio grandi , ilsoo ahn , christian s. jensen",sigmod record,1994,tsql2 language specification,"richard thomas snodgrass , ilsoo ahn , gadi ariav , don batory , james clifford , curtis e. dyreson , ramez elmasri , fabio grandi , christian s. jensen , wolfgang k &#228; fer , nick kline , krishna kulkarni , t. y. cliff leung , nikos lorentzos , john f. roddick , arie segev , michael d. soo , suryanarayana m. sripada",acm sigmod record,1994,4847
1,what happens during a join ? dissecting cpu and memory optimization effects,"stefan manegold , martin l. kersten , peter a. boncz",vldb,2000,what happens during a join ? dissecting cpu and memory optimization effects,"stefan manegold , peter a. boncz , martin l. kersten",very large data bases,2000,2744
1,mining needle in a haystack : classifying rare classes via two-phase rule induction,"ramesh c. agarwal , mahesh v. joshi",sigmod conference,2001,mining needle in a haystack : classifying rare classes via two-phase rule induction,"mahesh v. joshi , ramesh c. agarwal , vipin kumar",international conference on management of data,2001,5211
1,c2p : clustering based on closest pairs,"yannis theodoridis , alexandros nanopoulos , yannis manolopoulos",vldb,2001,c2p : clustering based on closest pairs,"alexandros nanopoulos , yannis theodoridis , yannis manolopoulos",very large data bases,2001,1061
1,retina : a real-time traffic navigation system,"edward chan , tei-wei kuo , s. w. ng , dick hung , kam-yiu lam",sigmod conference,2001,retina : a real-time traffic navigation system,"kam-yiu lam , edward chan , tei-wei kuo , s. w. ng , dick hung",international conference on management of data,2001,1022
1,sensor : the atomic computing particle,vijay kumar,sigmod record,2003,sensor : the atomic computing particle,vijay kumar,acm sigmod record,2003,1090
1,benchmarking queries over trees : learning the hard truth the hard way,"sophie cluet , fanny wattez , véronique benzaken , guy ferran , christian fiegel",sigmod conference,2000,benchmarking queries over trees : learning the hard truth the hard way,"fanny wattez , sophie cluet , v &#233; ronique benzaken , guy ferran , christian fiegel",international conference on management of data,2000,5466
1,logical logging to extend recovery to new domains,"david b. lomet , mark r. tuttle",sigmod conference,1999,logical logging to extend recovery to new domains,"david lomet , mark tuttle",international conference on management of data,1999,6706
1,an extension of the relational data model to incorporate ordered domains,wilfred ng,acm trans . database syst .,2001,an extension of the relational data model to incorporate ordered domains,wilfred ng,acm transactions on database systems ( tods ),2001,7403
1,maximizing buffer and disk utilizations for news on-demand,"raymond t. ng , jinhai yang",vldb,1994,maximizing buffer and disk utilizations for news on-demand,"raymond t. ng , jinhai yang",very large data bases,1994,3514
1,cover your assets,michael a. olson,sigmod conference,1995,cover your assets,michael a. olson,international conference on management of data,1995,4743
1,leveraging the information asset,janet perna,sigmod conference,1995,leveraging the information asset,janet perna,international conference on management of data,1995,5945
1,predator : an or-dbms with enhanced data types,"praveen seshadri , mark paskin",sigmod conference,1997,predator : an or-dbms with enhanced data types,"praveen seshadri , mark paskin",international conference on management of data,1997,3193
1,efficient checking of temporal integrity constraints using bounded history encoding,jan chomicki,acm trans . database syst .,1995,efficient checking of temporal integrity constraints using bounded history encoding,jan chomicki,acm transactions on database systems ( tods ),1995,2000
1,toxgene : a template-based data generator for xml,"alberto o. mendelzon , john keenleyside , denilson barbosa , kelly a. lyons",sigmod conference,2002,toxgene : a template-based data generator for xml,"denilson barbosa , alberto mendelzon , john keenleyside , kelly lyons",international conference on management of data,2002,5805
1,securing xml documents : the author-x project demonstration,"elisa bertino , elena ferrari , silvana castano",sigmod conference,2001,securing xml documents : the author-x project demonstration,"elisa bertino , silvana castano , elena ferrari",international conference on management of data,2001,291
1,multigranularity locking in multiple job classes transaction processing system,"sheung-lun hung , shan-hoi ng",sigmod record,1995,multigranularity locking in multiple job classes transaction processing system,"shan-hoi ng , sheung-lun hung",acm sigmod record,1995,723
1,exposing undergraduate students to database system internals,"anastassia ailamaki , joseph m. hellerstein",sigmod record,2003,exposing undergraduate students to database system internals,"anastassia ailamaki , joseph m. hellerstein",acm sigmod record,2003,4838
1,efficient numerical error bounding for replicated network services,"haifeng yu , amin vahdat",vldb,2000,efficient numerical error bounding for replicated network services,"haifeng yu , amin vahdat",very large data bases,2000,4879
1,capability based mediation in tsimmis,"hector garcia-molina , murty valiveti , chen li , ramana yerneni , jeffrey d. ullman , vasilis vassalos , yannis papakonstantinou",sigmod conference,1998,capability based mediation in tsimmis,"chen li , ramana yerneni , vasilis vassalos , hector garcia-molina , yannis papakonstantinou , jeffrey ullman , murty valiveti",international conference on management of data,1998,635
1,transaction chopping : algorithms and performance studies,"dennis shasha , eric simon , patrick valduriez , françois llirbat",acm trans . database syst .,1995,transaction chopping : algorithms and performance studies,"dennis shasha , francois llirbat , eric simon , patrick valduriez",acm transactions on database systems ( tods ),1995,5773
1,ontologies : a silver bullet for knowledge management and electronic commerce - book review,antonio badia,sigmod record,2002,"review of ontologies : a silver bullet for knowledge management and electronic commerce by dieter fensel . springer-verlag , 2002 .",antonio badia,acm sigmod record,2002,5217
1,normalization in oodb design,byung suk lee,sigmod record,1995,normalization in oodb design,byung s. lee,acm sigmod record,1995,3241
1,"tcp-d - the challenges , issues and results",ramesh bhashyam,sigmod record,1996,"tpc-d-the challenges , issues and results",ramesh bhashyam,acm sigmod record,1996,7149
1,buffering and read-ahead strategies for external mergesort,"per-åke larson , weiye zhang",vldb,1998,buffering and read-ahead strategies for external mergesort,"weiye zhang , per - &#197; ke larson",very large data bases,1998,2176
1,"preservation of digital data with self-validating , self-instantiating knowledge-based archives","reagan moore , bertram ludäscher , richard marciano",sigmod record,2001,"preservation of digital data with self-validating , self-instantiating knowledge-based archives","bertram lud &#228; scher , richard marciano , reagan moore",acm sigmod record,2001,731
1,cq : a personalized update monitoring toolkit,"david buttler , tong zhou , ling liu , paul benninghoff , wei han , calton pu , fenghua yu , wei tang , john biggs",sigmod conference,1998,cq : a personalized update monitoring toolkit,"ling liu , calton pu , wei tang , david buttler , john biggs , tong zhou , paul benninghoff , wei han , fenghua yu",international conference on management of data,1998,6926
1,"domains , relations and religious wars",rafael camps,sigmod record,1996,"domains , relations and religious wars",r. camps,acm sigmod record,1996,6959
1,"in reply to domains , relations and religious wars",hugh darwen,sigmod record,1996,"in reply to domains , relations and religious wars",hugh darwen,acm sigmod record,1996,5206
1,balancing histogram optimality and practicality for query result size estimation,"yannis e. ioannidis , viswanath poosala",sigmod conference,1995,balancing histogram optimality and practicality for query result size estimation,"yannis e. ioannidis , viswanath poosala",international conference on management of data,1995,5224
